,state,edit_at,city,name,date,date_text,id,Link1,location,geocode,point,lon,lat
24,North Carolina,"<a href=""https://github.com/2020PB/police-brutality/blob/main/reports/North Carolina.md"">Click Here</a>",Raleigh,Raleigh police roughly arrest protesters,2020-06-18,June 18th,nc-raleigh-8,"<a href=""https://www.wral.com/two-arrested-after-n-c-born-protest-in-downtown-raleigh/19151333/"">Click Here</a>","Raleigh, North Carolina","Raleigh, Wake County, North Carolina, United States of America","35.7803977, -78.6390989, 0.0",35.7803977,-78.63909890000001
6,North Carolina,"<a href=""https://github.com/2020PB/police-brutality/blob/main/reports/North Carolina.md"">Click Here</a>",Charlotte,Charlotte Sheriff declares Jail Support station unlawful; officer assaults press during mass arrests,2020-06-18,June 18th,nc-charlotte-3,"<a href=""https://www.facebook.com/queencitynerve/videos/302573580898919/"">Click Here</a>","Charlotte, North Carolina","Charlotte, Mecklenburg County, North Carolina, United States of America","35.2272, -80.843083, 0.0",35.2272,-80.843083
881,Oregon,"<a href=""https://github.com/2020PB/police-brutality/blob/main/reports/Oregon.md"">Click Here</a>",Portland,Protester bleeding from head after he was shot by police,2020-06-19,June 19th,or-portland-29,"<a href=""https://www.reddit.com/r/2020PoliceBrutality/comments/hchk22/portland_police_shot_a_protester_in_the_head/"">Click Here</a>","Portland, Oregon","Portland, Metro, Multnomah County, Oregon, United States of America","45.5202471, -122.6741949, 0.0",45.5202471,-122.6741949
830,Kentucky,"<a href=""https://github.com/2020PB/police-brutality/blob/main/reports/Kentucky.md"">Click Here</a>",Louisville,Protester medic beaten and arrested,2020-06-19,June 19th,ky-louisville-12,"<a href=""https://mobile.twitter.com/martasmom98/status/1278231132753080321"">Click Here</a>","Louisville, Kentucky","Louisville, Jefferson County, Kentucky, United States of America","38.2542376, -85.759407, 0.0",38.254237599999996,-85.759407
335,Nevada,"<a href=""https://github.com/2020PB/police-brutality/blob/main/reports/Nevada.md"">Click Here</a>",Las Vegas,Police charge and shove protesters,2020-06-20,June 20th,nv-lasvegas-6,"<a href=""https://www.reddit.com/r/PublicFreakout/comments/hcfocc/cops_rush_protest_crowd_in_las_vegas/"">Click Here</a>","Las Vegas, Nevada","Las Vegas, Clark County, Nevada, United States of America","36.1672559, -115.1485163, 0.0",36.1672559,-115.1485163
882,Oregon,"<a href=""https://github.com/2020PB/police-brutality/blob/main/reports/Oregon.md"">Click Here</a>",Portland,Police clear Justice Center protesters using impact munitions and stun grenades,2020-06-20,June 20th,or-portland-390,"<a href=""https://twitter.com/hungrybowtie/status/1274600755542933506"">Click Here</a>","Portland, Oregon","Portland, Metro, Multnomah County, Oregon, United States of America","45.5202471, -122.6741949, 0.0",45.5202471,-122.6741949
192,California,"<a href=""https://github.com/2020PB/police-brutality/blob/main/reports/California.md"">Click Here</a>",Compton,"Sheriff's Deputies fire less-lethal rounds, tear gas at protesters",2020-06-21,June 21st,ca-compton-2,"<a href=""https://twitter.com/LATACO/status/1274874827786997761"">Click Here</a>","Compton, California","Compton, Los Angeles County, California, United States of America","33.894927, -118.226624, 0.0",33.894927,-118.226624
450,Ohio,"<a href=""https://github.com/2020PB/police-brutality/blob/main/reports/Ohio.md"">Click Here</a>",Columbus,Man maced by police,2020-06-21,June 21st,oh-columbus-19,"<a href=""https://www.reddit.com/r/Columbus/comments/hdf4hu/cpd_just_hit_and_maced_a_double_amputee_bravo_you/"">Click Here</a>","Columbus, Ohio","Columbus, Franklin County, Ohio, United States of America","39.9622601, -83.0007065, 0.0",39.9622601,-83.00070649999999
792,Virginia,"<a href=""https://github.com/2020PB/police-brutality/blob/main/reports/Virginia.md"">Click Here</a>",Richmond,Police pepper-spray journalist,2020-06-21,June 21st,va-richmond-7,"<a href=""https://twitter.com/aeringle/status/1274898298923606017"">Click Here</a>","Richmond, Virginia","Richmond, Richmond City, Virginia, 23298, United States of America","37.5385087, -77.43428, 0.0",37.53850870000001,-77.43428
451,Ohio,"<a href=""https://github.com/2020PB/police-brutality/blob/main/reports/Ohio.md"">Click Here</a>",Columbus,"Protester dragged into street, thrown to ground and arrested",2020-06-21,June 21st,oh-columbus-20,"<a href=""https://www.reddit.com/r/Bad_Cop_No_Donut/comments/hdj106/062120_columbus_ohio_police_dragging_medic_into/"">Click Here</a>","Columbus, Ohio","Columbus, Franklin County, Ohio, United States of America","39.9622601, -83.0007065, 0.0",39.9622601,-83.00070649999999
170,Colorado,"<a href=""https://github.com/2020PB/police-brutality/blob/main/reports/Colorado.md"">Click Here</a>",Denver,Police pepper spray protester with hands up,2020-06-21,(Believed to be) June 21st,co-denver-20,"<a href=""https://twitter.com/wisenoons/status/1274743833410994176"">Click Here</a>","Denver, Colorado","Denver, Denver County, Colorado, United States of America","39.7392364, -104.9848623, 0.0",39.7392364,-104.98486229999999
452,Ohio,"<a href=""https://github.com/2020PB/police-brutality/blob/main/reports/Ohio.md"">Click Here</a>",Columbus,"Police shove protesters, ram them with bikes",2020-06-21,June 21st,oh-columbus-21,"<a href=""https://www.reddit.com/r/PublicFreakout/comments/hdwgfb/columbus_ohio_cops_ram_protesters_with_bikes/"">Click Here</a>","Columbus, Ohio","Columbus, Franklin County, Ohio, United States of America","39.9622601, -83.0007065, 0.0",39.9622601,-83.00070649999999
809,South Carolina,"<a href=""https://github.com/2020PB/police-brutality/blob/main/reports/South Carolina.md"">Click Here</a>",Charleston,Police violently arrest protester,2020-06-22,June 22nd,sc-charleston-3,"<a href=""https://twitter.com/greg_doucette/status/1275254514501799939"">Click Here</a>","Charleston, South Carolina","Charleston, Charleston County, South Carolina, United States of America","32.7876012, -79.9402728, 0.0",32.7876012,-79.9402728
405,Iowa,"<a href=""https://github.com/2020PB/police-brutality/blob/main/reports/Iowa.md"">Click Here</a>",Des Moines,"Police push, shove and pepper-spray protesters",2020-06-22,June 22nd,ia-desmoines-9,"<a href=""https://www.instagram.com/tv/CBw5mKxjHPq/"">Click Here</a>","Des Moines, Iowa","Des Moines, Polk County, Iowa, United States of America","41.5910641, -93.6037149, 0.0",41.5910641,-93.60371490000001
512,Washington DC,"<a href=""https://github.com/2020PB/police-brutality/blob/main/reports/Washington DC.md"">Click Here</a>",DC,Police violently arrest protester,2020-06-22,June 22nd,dc-dc-16,"<a href=""https://twitter.com/JoshuaPotash/status/1275249479554400256"">Click Here</a>","DC, Washington DC","Washington, District of Columbia, 20230, United States of America","38.8949924, -77.0365581, 0.0",38.8949924,-77.0365581
515,Washington DC,"<a href=""https://github.com/2020PB/police-brutality/blob/main/reports/Washington DC.md"">Click Here</a>",DC,Police pepper spray protesters with hands up,2020-06-22,June 22nd,dc-dc-23,"<a href=""https://twitter.com/LiteraryMouse/status/1275228261140791299"">Click Here</a>","DC, Washington DC","Washington, District of Columbia, 20230, United States of America","38.8949924, -77.0365581, 0.0",38.8949924,-77.0365581
514,Washington DC,"<a href=""https://github.com/2020PB/police-brutality/blob/main/reports/Washington DC.md"">Click Here</a>",DC,Unidentified man working alongside police hits protesters with baton,2020-06-22,June 22nd,dc-dc-19,"<a href=""https://twitter.com/JasonPatinkin/status/1275252759634329602"">Click Here</a>","DC, Washington DC","Washington, District of Columbia, 20230, United States of America","38.8949924, -77.0365581, 0.0",38.8949924,-77.0365581
513,Washington DC,"<a href=""https://github.com/2020PB/police-brutality/blob/main/reports/Washington DC.md"">Click Here</a>",DC,Protesters attempt to vandalize Andrew Jackson statue; police escalate violence,2020-06-22,June 22nd,dc-dc-17,"<a href=""https://twitter.com/Jsc_35/status/1275255059325030401"">Click Here</a>","DC, Washington DC","Washington, District of Columbia, 20230, United States of America","38.8949924, -77.0365581, 0.0",38.8949924,-77.0365581
404,Iowa,"<a href=""https://github.com/2020PB/police-brutality/blob/main/reports/Iowa.md"">Click Here</a>",Des Moines,Police make violent arrests & harass protesters filming,2020-06-22,June 22nd,ia-desmoines-10,"<a href=""https://twitter.com/greg_doucette/status/1275641933671673859"">Click Here</a>","Des Moines, Iowa","Des Moines, Polk County, Iowa, United States of America","41.5910641, -93.6037149, 0.0",41.5910641,-93.60371490000001
516,Washington DC,"<a href=""https://github.com/2020PB/police-brutality/blob/main/reports/Washington DC.md"">Click Here</a>",DC,Footage shows officer with tape over badge number,2020-06-23,June 23rd,dc-dc-20,"<a href=""https://twitter.com/wyattreed13/status/1275623256406581251"">Click Here</a>","DC, Washington DC","Washington, District of Columbia, 20230, United States of America","38.8949924, -77.0365581, 0.0",38.8949924,-77.0365581
815,Arizona,"<a href=""https://github.com/2020PB/police-brutality/blob/main/reports/Arizona.md"">Click Here</a>",Phoenix,Protests at Trump rally met with pepper spray,2020-06-23,June 23rd,az-phoenix-4,"<a href=""https://twitter.com/JoshuaPotash/status/1275585545499021313"">Click Here</a>","Phoenix, Arizona","Phoenix, Maricopa County, Arizona, United States of America","33.4484367, -112.0741417, 0.0",33.448436699999995,-112.07414170000001
519,Washington DC,"<a href=""https://github.com/2020PB/police-brutality/blob/main/reports/Washington DC.md"">Click Here</a>",DC,"Police use pepper spray, flashbangs and tear gas to disperse protest",2020-06-23,June 23rd,dc-dc-18,"<a href=""https://twitter.com/rawsmedia/status/1275671784554221574"">Click Here</a>","DC, Washington DC","Washington, District of Columbia, 20230, United States of America","38.8949924, -77.0365581, 0.0",38.8949924,-77.0365581
181,Tennessee,"<a href=""https://github.com/2020PB/police-brutality/blob/main/reports/Tennessee.md"">Click Here</a>",Nashville,Police confiscate protester supplies,2020-06-23,June 23rd,tn-nashville-1,"<a href=""https://twitter.com/brotherjones_/status/1275520373472268292"">Click Here</a>","Nashville, Tennessee","Nashville-Davidson, Davidson County, Tennessee, United States of America","36.1622296, -86.7743531, 0.0",36.1622296,-86.7743531
518,Washington DC,"<a href=""https://github.com/2020PB/police-brutality/blob/main/reports/Washington DC.md"">Click Here</a>",DC,Eyewitness reports police destroyed supplied and attacked medics,2020-06-23,June 23rd,dc-dc-22,"<a href=""https://twitter.com/maryamnayebyazd/status/1275493238619635714"">Click Here</a>","DC, Washington DC","Washington, District of Columbia, 20230, United States of America","38.8949924, -77.0365581, 0.0",38.8949924,-77.0365581
517,Washington DC,"<a href=""https://github.com/2020PB/police-brutality/blob/main/reports/Washington DC.md"">Click Here</a>",DC,Police pepper-spray peaceful protesters,2020-06-23,June 23rd,dc-dc-21,"<a href=""https://twitter.com/DotElection/status/1275289922740662275"">Click Here</a>","DC, Washington DC","Washington, District of Columbia, 20230, United States of America","38.8949924, -77.0365581, 0.0",38.8949924,-77.0365581
793,Virginia,"<a href=""https://github.com/2020PB/police-brutality/blob/main/reports/Virginia.md"">Click Here</a>",Richmond,Police escalate against protesters outside city hall,2020-06-23,June 23rd,va-richmond-8,"<a href=""https://twitter.com/NotLevar/status/1275368795444588544"">Click Here</a>","Richmond, Virginia","Richmond, Richmond City, Virginia, 23298, United States of America","37.5385087, -77.43428, 0.0",37.53850870000001,-77.43428
124,Pennsylvania,"<a href=""https://github.com/2020PB/police-brutality/blob/main/reports/Pennsylvania.md"">Click Here</a>",Philadelphia,Counter-Terrorism Unit detains reporter,2020-06-23,June 23rd,pa-philadelphia-12,"<a href=""https://twitter.com/samanthamelamed/status/1275522909604372481"">Click Here</a>","Philadelphia, Pennsylvania","Philadelphia, Philadelphia County, Pennsylvania, United States of America","39.9527237, -75.1635262, 0.0",39.9527237,-75.16352619999999
182,Tennessee,"<a href=""https://github.com/2020PB/police-brutality/blob/main/reports/Tennessee.md"">Click Here</a>",Nashville,Police confiscate protester supplies,2020-06-25,June 25th,tn-nashville-2,"<a href=""https://twitter.com/brotherjones_/status/1276133377863749637"">Click Here</a>","Nashville, Tennessee","Nashville-Davidson, Davidson County, Tennessee, United States of America","36.1622296, -86.7743531, 0.0",36.1622296,-86.7743531
885,Oregon,"<a href=""https://github.com/2020PB/police-brutality/blob/main/reports/Oregon.md"">Click Here</a>",Portland,Man shot in eye with stinger pellet,2020-06-26,June 26th,or-portland-31,"<a href=""https://twitter.com/chadloder/status/1277360969228771329"">Click Here</a>","Portland, Oregon","Portland, Metro, Multnomah County, Oregon, United States of America","45.5202471, -122.6741949, 0.0",45.5202471,-122.6741949
183,Tennessee,"<a href=""https://github.com/2020PB/police-brutality/blob/main/reports/Tennessee.md"">Click Here</a>",Nashville,Police target activist leader,2020-06-26,June 26th,tn-nashville-3,"<a href=""https://twitter.com/TheTNHoller/status/1276713817284792324"">Click Here</a>","Nashville, Tennessee","Nashville-Davidson, Davidson County, Tennessee, United States of America","36.1622296, -86.7743531, 0.0",36.1622296,-86.7743531
883,Oregon,"<a href=""https://github.com/2020PB/police-brutality/blob/main/reports/Oregon.md"">Click Here</a>",Portland,"Police tear gas fleeing protesters, pull individuals from cars",2020-06-26,June 26th,or-portland-27,"<a href=""https://twitter.com/hungrybowtie/status/1276446115831803906"">Click Here</a>","Portland, Oregon","Portland, Metro, Multnomah County, Oregon, United States of America","45.5202471, -122.6741949, 0.0",45.5202471,-122.6741949
798,Virginia,"<a href=""https://github.com/2020PB/police-brutality/blob/main/reports/Virginia.md"">Click Here</a>",Richmond,Police fire tear gas at protesters,2020-06-26,June 26th,va-richmond-14,"<a href=""https://twitter.com/greg_doucette/status/1287252197487648768"">Click Here</a>","Richmond, Virginia","Richmond, Richmond City, Virginia, 23298, United States of America","37.5385087, -77.43428, 0.0",37.53850870000001,-77.43428
884,Oregon,"<a href=""https://github.com/2020PB/police-brutality/blob/main/reports/Oregon.md"">Click Here</a>",Portland,"Police use flashbangs and tear gas to disperse protesters, catching lawyers and journalists in the fray",2020-06-26,June 26th,or-portland-28,"<a href=""https://twitter.com/hungrybowtie/status/1276454928823668738"">Click Here</a>","Portland, Oregon","Portland, Metro, Multnomah County, Oregon, United States of America","45.5202471, -122.6741949, 0.0",45.5202471,-122.6741949
796,Virginia,"<a href=""https://github.com/2020PB/police-brutality/blob/main/reports/Virginia.md"">Click Here</a>",Richmond,Police shove and pepper-spray protester,2020-06-26,June 26th,va-richmond-12,"<a href=""https://twitter.com/woznyphoto/status/1276865711835623424"">Click Here</a>","Richmond, Virginia","Richmond, Richmond City, Virginia, 23298, United States of America","37.5385087, -77.43428, 0.0",37.53850870000001,-77.43428
797,Virginia,"<a href=""https://github.com/2020PB/police-brutality/blob/main/reports/Virginia.md"">Click Here</a>",Richmond,Attorney arrested for photographing police staging area,2020-06-26,June 26th,va-richmond-13,"<a href=""https://twitter.com/rva_charlie/status/1276739841951248384"">Click Here</a>","Richmond, Virginia","Richmond, Richmond City, Virginia, 23298, United States of America","37.5385087, -77.43428, 0.0",37.53850870000001,-77.43428
886,Oregon,"<a href=""https://github.com/2020PB/police-brutality/blob/main/reports/Oregon.md"">Click Here</a>",Portland,Police fire explosives from behind barricade,2020-06-26,June 26th,or-portland-40,"<a href=""https://twitter.com/greg_doucette/status/1277685523595788290"">Click Here</a>","Portland, Oregon","Portland, Metro, Multnomah County, Oregon, United States of America","45.5202471, -122.6741949, 0.0",45.5202471,-122.6741949
187,California,"<a href=""https://github.com/2020PB/police-brutality/blob/main/reports/California.md"">Click Here</a>",Beverly Hills,Beverly Hills police use LRAD (sound cannon) at protest,2020-06-26,June 26th,ca-beverlyhills-1,"<a href=""https://youtu.be/doQMq8Iwcjc?t=94"">Click Here</a>","Beverly Hills, California","Beverly Hills, Los Angeles County, California, United States of America","34.0696501, -118.3963062, 0.0",34.0696501,-118.3963062
795,Virginia,"<a href=""https://github.com/2020PB/police-brutality/blob/main/reports/Virginia.md"">Click Here</a>",Richmond,Police drag protester off bike,2020-06-26,June 26th,va-richmond-11,"<a href=""https://twitter.com/woznyphoto/status/1276727667979694081"">Click Here</a>","Richmond, Virginia","Richmond, Richmond City, Virginia, 23298, United States of America","37.5385087, -77.43428, 0.0",37.53850870000001,-77.43428
794,Virginia,"<a href=""https://github.com/2020PB/police-brutality/blob/main/reports/Virginia.md"">Click Here</a>",Richmond,Man struck in face by explosive round,2020-06-26,June 26th,va-richmond-10,"<a href=""https://twitter.com/woznyphoto/status/1276734657237864448"">Click Here</a>","Richmond, Virginia","Richmond, Richmond City, Virginia, 23298, United States of America","37.5385087, -77.43428, 0.0",37.53850870000001,-77.43428
520,Washington DC,"<a href=""https://github.com/2020PB/police-brutality/blob/main/reports/Washington DC.md"">Click Here</a>",DC,Police target protester handing out water,2020-06-27,June 27th,dc-dc-24,"<a href=""https://twitter.com/FordFischer/status/1277457274395676672"">Click Here</a>","DC, Washington DC","Washington, District of Columbia, 20230, United States of America","38.8949924, -77.0365581, 0.0",38.8949924,-77.0365581
306,Florida,"<a href=""https://github.com/2020PB/police-brutality/blob/main/reports/Florida.md"">Click Here</a>",Miami,Police deployed two rounds of tear gas against peaceful protesters,2020-06-27,June 27th,fl-miami-2,"<a href=""https://twitter.com/inaminorkey/status/1277070049518465032"">Click Here</a>","Miami, Florida","Miami, Miami-Dade County, Florida, United States of America","25.7742658, -80.1936589, 0.0",25.7742658,-80.1936589
85,Texas,"<a href=""https://github.com/2020PB/police-brutality/blob/main/reports/Texas.md"">Click Here</a>",Austin,Police punch arrestee on ground,2020-06-27,June 27th,tx-austin-12,"<a href=""https://twitter.com/AltUniverseWash/status/1277104706222002177"">Click Here</a>","Austin, Texas","Austin, Travis County, Texas, United States of America","30.2711286, -97.7436995, 0.0",30.2711286,-97.7436995
816,Arizona,"<a href=""https://github.com/2020PB/police-brutality/blob/main/reports/Arizona.md"">Click Here</a>",Tempe,Police pepper spray protesters on sidewalk,2020-06-27,June 27th,az-tempe-1,"<a href=""https://twitter.com/greg_doucette/status/1277432629353238535"">Click Here</a>","Tempe, Arizona","Tempe, Maricopa County, Arizona, United States of America","33.4255056, -111.9400125, 0.0",33.4255056,-111.9400125
145,Colorado,"<a href=""https://github.com/2020PB/police-brutality/blob/main/reports/Colorado.md"">Click Here</a>",Aurora,Aurora police violently disperse violin vigil,2020-06-27,June 27th,co-aurora-1,"<a href=""https://www.reddit.com/r/Bad_Cop_No_Donut/comments/hhfrh8/062820_musicians_in_aurora_colorado_honoring/"">Click Here</a>","Aurora, Colorado","Aurora, Arapahoe County, Colorado, United States of America","39.729432, -104.8319196, 0.0",39.729432,-104.8319196
831,Kentucky,"<a href=""https://github.com/2020PB/police-brutality/blob/main/reports/Kentucky.md"">Click Here</a>",Louisville,Police destroy protester belongings after clearing park,2020-06-27,June 27th,ky-louisville-20,"<a href=""https://www.leoweekly.com/2020/07/city-destroys-protesters-property-supplies-community-joins-donate-next-day/"">Click Here</a>","Louisville, Kentucky","Louisville, Jefferson County, Kentucky, United States of America","38.2542376, -85.759407, 0.0",38.254237599999996,-85.759407
887,Oregon,"<a href=""https://github.com/2020PB/police-brutality/blob/main/reports/Oregon.md"">Click Here</a>",Portland,"Police charge protesters, shoving them and beating them with batons",2020-06-27,June 27th,or-portland-30,"<a href=""https://www.reddit.com/r/ThatsInsane/comments/hgr2ld/cops_gone_crazyportlandpolice_has_finally_lost/"">Click Here</a>","Portland, Oregon","Portland, Metro, Multnomah County, Oregon, United States of America","45.5202471, -122.6741949, 0.0",45.5202471,-122.6741949
58,Missouri,"<a href=""https://github.com/2020PB/police-brutality/blob/main/reports/Missouri.md"">Click Here</a>",Florissant,Police push protesters off lawn,2020-06-27,June 27th,mo-florissant-2,"<a href=""https://twitter.com/NassimBnchabane/status/1277054826858323969"">Click Here</a>","Florissant, Missouri","Florissant, Saint Louis County, Missouri, 63031, United States of America","38.7919683, -90.3227803, 0.0",38.79196829999999,-90.32278029999999
893,Oregon,"<a href=""https://github.com/2020PB/police-brutality/blob/main/reports/Oregon.md"">Click Here</a>",Portland,Police shove and mace protester with hands up,2020-06-28,June 28th,or-portland-36,"<a href=""https://twitter.com/1misanthrophile/status/1277340657648984064"">Click Here</a>","Portland, Oregon","Portland, Metro, Multnomah County, Oregon, United States of America","45.5202471, -122.6741949, 0.0",45.5202471,-122.6741949
888,Oregon,"<a href=""https://github.com/2020PB/police-brutality/blob/main/reports/Oregon.md"">Click Here</a>",Portland,Police tear gas protesters for no evident reason,2020-06-28,June 28th,or-portland-35,"<a href=""https://twitter.com/hungrybowtie/status/1277125125934964736"">Click Here</a>","Portland, Oregon","Portland, Metro, Multnomah County, Oregon, United States of America","45.5202471, -122.6741949, 0.0",45.5202471,-122.6741949
889,Oregon,"<a href=""https://github.com/2020PB/police-brutality/blob/main/reports/Oregon.md"">Click Here</a>",Portland,Police beat wrong person for vandalism,2020-06-28,June 28th,or-portland-32,"<a href=""https://twitter.com/hungrybowtie/status/1277156963449593856"">Click Here</a>","Portland, Oregon","Portland, Metro, Multnomah County, Oregon, United States of America","45.5202471, -122.6741949, 0.0",45.5202471,-122.6741949
640,New York,"<a href=""https://github.com/2020PB/police-brutality/blob/main/reports/New York.md"">Click Here</a>",New York City,Police shove their way through crowd,2020-06-28,June 28th,ny-newyorkcity-52,"<a href=""https://twitter.com/GaelicSteel/status/1277344251970494469"">Click Here</a>","New York City, New York","New York, United States of America","40.7127281, -74.0060152, 0.0",40.7127281,-74.0060152
890,Oregon,"<a href=""https://github.com/2020PB/police-brutality/blob/main/reports/Oregon.md"">Click Here</a>",Portland,"Riot police charge, tackle and arrest protesters",2020-06-28,June 28th,or-portland-33,"<a href=""https://twitter.com/hungrybowtie/status/1277159562563317760"">Click Here</a>","Portland, Oregon","Portland, Metro, Multnomah County, Oregon, United States of America","45.5202471, -122.6741949, 0.0",45.5202471,-122.6741949
638,New York,"<a href=""https://github.com/2020PB/police-brutality/blob/main/reports/New York.md"">Click Here</a>",New York City,Police escalate to violence at Queer Liberation March,2020-06-28,June 28th,ny-newyorkcity-49,"<a href=""https://twitter.com/elielcruz/status/1277346244952817669"">Click Here</a>","New York City, New York","New York, United States of America","40.7127281, -74.0060152, 0.0",40.7127281,-74.0060152
892,Oregon,"<a href=""https://github.com/2020PB/police-brutality/blob/main/reports/Oregon.md"">Click Here</a>",Portland,Police charge crowd; shove multiple protesters,2020-06-28,June 28th,or-portland-37,"<a href=""https://twitter.com/1misanthrophile/status/1277340069867601920"">Click Here</a>","Portland, Oregon","Portland, Metro, Multnomah County, Oregon, United States of America","45.5202471, -122.6741949, 0.0",45.5202471,-122.6741949
194,California,"<a href=""https://github.com/2020PB/police-brutality/blob/main/reports/California.md"">Click Here</a>",Gustine,Protesters attacked; police shake hands of attackers; tell protesters to wait in patrol cars,2020-06-28,June 28th,ca-gustine-1,"<a href=""https://twitter.com/stussycastro/status/1277345103862837249"">Click Here</a>","Gustine, California","Gustine, Merced County, California, United States of America","37.2577171, -120.9988154, 0.0",37.2577171,-120.99881540000001
36,Michigan,"<a href=""https://github.com/2020PB/police-brutality/blob/main/reports/Michigan.md"">Click Here</a>",Detroit,Police run over protesters,2020-06-28,June 28th,mi-detroit-9,"<a href=""https://twitter.com/DJEazyTwist/status/1277430912653950976"">Click Here</a>","Detroit, Michigan","Detroit, Wayne County, Michigan, United States of America","42.3315509, -83.0466403, 0.0",42.331550899999996,-83.04664029999999
639,New York,"<a href=""https://github.com/2020PB/police-brutality/blob/main/reports/New York.md"">Click Here</a>",New York City,Police shove bicyclist to the ground,2020-06-28,June 28th,ny-newyorkcity-51,"<a href=""https://twitter.com/greg_doucette/status/1277636698806116352"">Click Here</a>","New York City, New York","New York, United States of America","40.7127281, -74.0060152, 0.0",40.7127281,-74.0060152
