,state,edit_at,city,name,date,date_text,id,Link1,location,geocode,point,lon,lat
1074,Oregon,"<a href=""https://github.com/2020PB/police-brutality/blob/main/reports/Oregon.md"">Click Here</a>",Portland,Journalist shoved and pepper-sprayed,2020-08-01,August 1st,or-portland-224,"<a href=""https://twitter.com/FancyJenkins/status/1289808596243374082"">Click Here</a>","Portland, Oregon","Portland, Metro, Multnomah County, Oregon, United States of America","45.5202471, -122.6741949, 0.0",45.5202471,-122.6741949
1075,Oregon,"<a href=""https://github.com/2020PB/police-brutality/blob/main/reports/Oregon.md"">Click Here</a>",Portland,"Police charge, tackle, and pepper spray protesters",2020-08-01,August 1st,or-portland-225,"<a href=""https://twitter.com/hungrybowtie/status/1289791877223350273"">Click Here</a>","Portland, Oregon","Portland, Metro, Multnomah County, Oregon, United States of America","45.5202471, -122.6741949, 0.0",45.5202471,-122.6741949
87,Texas,"<a href=""https://github.com/2020PB/police-brutality/blob/main/reports/Texas.md"">Click Here</a>",Austin,Police shove and pepper spray protesters,2020-08-01,August 1st,tx-austin-16,"<a href=""https://www.youtube.com/watch?v=EmglMDC-OJU"">Click Here</a>","Austin, Texas","Austin, Travis County, Texas, United States of America","30.2711286, -97.7436995, 0.0",30.2711286,-97.7436995
388,Utah,"<a href=""https://github.com/2020PB/police-brutality/blob/main/reports/Utah.md"">Click Here</a>",Cottonwood Heights,Police beat and pepper spray protesters during violent arrests,2020-08-02,August 2nd,ut-cottonwoodheights-1,"<a href=""https://twitter.com/Harryson_james/status/1290094912805847041"">Click Here</a>","Cottonwood Heights, Utah","Cottonwood Heights, Utah, United States of America","40.6196702, -111.8102104, 0.0",40.6196702,-111.8102104
1078,Oregon,"<a href=""https://github.com/2020PB/police-brutality/blob/main/reports/Oregon.md"">Click Here</a>",Portland,Police charge and assault protesters,2020-08-03,August 3rd,or-portland-228,"<a href=""https://twitter.com/1misanthrophile/status/1290547444766277633"">Click Here</a>","Portland, Oregon","Portland, Metro, Multnomah County, Oregon, United States of America","45.5202471, -122.6741949, 0.0",45.5202471,-122.6741949
1080,Oregon,"<a href=""https://github.com/2020PB/police-brutality/blob/main/reports/Oregon.md"">Click Here</a>",Portland,Individuals pepper sprayed,2020-08-03,August 3rd,or-portland-230,"<a href=""https://twitter.com/TheHannahRay/status/1290550066814410753"">Click Here</a>","Portland, Oregon","Portland, Metro, Multnomah County, Oregon, United States of America","45.5202471, -122.6741949, 0.0",45.5202471,-122.6741949
1079,Oregon,"<a href=""https://github.com/2020PB/police-brutality/blob/main/reports/Oregon.md"">Click Here</a>",Portland,Police pepper spray protester,2020-08-03,August 3rd,or-portland-229,"<a href=""https://twitter.com/R3volutionDaddy/status/1290559156756213761"">Click Here</a>","Portland, Oregon","Portland, Metro, Multnomah County, Oregon, United States of America","45.5202471, -122.6741949, 0.0",45.5202471,-122.6741949
1081,Oregon,"<a href=""https://github.com/2020PB/police-brutality/blob/main/reports/Oregon.md"">Click Here</a>",Portland,Journalist hospitalized after arrest; protesters and journalists pepper sprayed,2020-08-04,August 4th,or-portland-231,"<a href=""https://twitter.com/MrOlmos/status/1290932904139210753"">Click Here</a>","Portland, Oregon","Portland, Metro, Multnomah County, Oregon, United States of America","45.5202471, -122.6741949, 0.0",45.5202471,-122.6741949
1082,Oregon,"<a href=""https://github.com/2020PB/police-brutality/blob/main/reports/Oregon.md"">Click Here</a>",Portland,Police throw explosives as they leave,2020-08-04,August 4th,or-portland-232,"<a href=""https://twitter.com/garbagefilth/status/1290916978509529089"">Click Here</a>","Portland, Oregon","Portland, Metro, Multnomah County, Oregon, United States of America","45.5202471, -122.6741949, 0.0",45.5202471,-122.6741949
1084,Oregon,"<a href=""https://github.com/2020PB/police-brutality/blob/main/reports/Oregon.md"">Click Here</a>",Portland,Police charge protesters a second time,2020-08-05,August 5th,or-portland-236,"<a href=""https://twitter.com/MrOlmos/status/1291246658760486913"">Click Here</a>","Portland, Oregon","Portland, Metro, Multnomah County, Oregon, United States of America","45.5202471, -122.6741949, 0.0",45.5202471,-122.6741949
1083,Oregon,"<a href=""https://github.com/2020PB/police-brutality/blob/main/reports/Oregon.md"">Click Here</a>",Portland,Police respond to vandalism with excessive force,2020-08-05,August 5th,or-portland-235,"<a href=""https://twitter.com/hungrybowtie/status/1291240005281562624"">Click Here</a>","Portland, Oregon","Portland, Metro, Multnomah County, Oregon, United States of America","45.5202471, -122.6741949, 0.0",45.5202471,-122.6741949
1085,Oregon,"<a href=""https://github.com/2020PB/police-brutality/blob/main/reports/Oregon.md"">Click Here</a>",Portland,Police shove members of the press during arrests,2020-08-05,August 5th,or-portland-237,"<a href=""https://twitter.com/R3volutionDaddy/status/1291246837005815808"">Click Here</a>","Portland, Oregon","Portland, Metro, Multnomah County, Oregon, United States of America","45.5202471, -122.6741949, 0.0",45.5202471,-122.6741949
1087,Oregon,"<a href=""https://github.com/2020PB/police-brutality/blob/main/reports/Oregon.md"">Click Here</a>",Portland,Police shove man with disability,2020-08-06,August 6th,or-portland-239,"<a href=""https://twitter.com/GriffinMalone6/status/1291644306323673090"">Click Here</a>","Portland, Oregon","Portland, Metro, Multnomah County, Oregon, United States of America","45.5202471, -122.6741949, 0.0",45.5202471,-122.6741949
1088,Oregon,"<a href=""https://github.com/2020PB/police-brutality/blob/main/reports/Oregon.md"">Click Here</a>",Portland,Officer singles out and pepper sprays protester without apparent cause,2020-08-06,August 6th,or-portland-240,"<a href=""https://twitter.com/GriffinMalone6/status/1291649145363554309"">Click Here</a>","Portland, Oregon","Portland, Metro, Multnomah County, Oregon, United States of America","45.5202471, -122.6741949, 0.0",45.5202471,-122.6741949
1089,Oregon,"<a href=""https://github.com/2020PB/police-brutality/blob/main/reports/Oregon.md"">Click Here</a>",Portland,Police shove members of the press,2020-08-06,August 6th,or-portland-241,"<a href=""https://twitter.com/MrOlmos/status/1291611855819964416"">Click Here</a>","Portland, Oregon","Portland, Metro, Multnomah County, Oregon, United States of America","45.5202471, -122.6741949, 0.0",45.5202471,-122.6741949
1090,Oregon,"<a href=""https://github.com/2020PB/police-brutality/blob/main/reports/Oregon.md"">Click Here</a>",Portland,Woman arrested and pepper sprayed after yelling at police,2020-08-06,August 6th,or-portland-247,"<a href=""https://twitter.com/_WhatRiot/status/1291631618319253505"">Click Here</a>","Portland, Oregon","Portland, Metro, Multnomah County, Oregon, United States of America","45.5202471, -122.6741949, 0.0",45.5202471,-122.6741949
1086,Oregon,"<a href=""https://github.com/2020PB/police-brutality/blob/main/reports/Oregon.md"">Click Here</a>",Portland,Police puncture tires of Snack Van,2020-08-06,August 6th,or-portland-238,"<a href=""https://twitter.com/PDXzane/status/1291608110591692800"">Click Here</a>","Portland, Oregon","Portland, Metro, Multnomah County, Oregon, United States of America","45.5202471, -122.6741949, 0.0",45.5202471,-122.6741949
1095,Oregon,"<a href=""https://github.com/2020PB/police-brutality/blob/main/reports/Oregon.md"">Click Here</a>",Portland,Officer knocks helmet off protester's head; officers refuse to allow him to retrieve it,2020-08-07,August 7th,or-portland-250,"<a href=""https://twitter.com/danielvmedia/status/1292228817889554432"">Click Here</a>","Portland, Oregon","Portland, Metro, Multnomah County, Oregon, United States of America","45.5202471, -122.6741949, 0.0",45.5202471,-122.6741949
1094,Oregon,"<a href=""https://github.com/2020PB/police-brutality/blob/main/reports/Oregon.md"">Click Here</a>",Portland,Reporter arrested,2020-08-07,August 7th,or-portland-245,"<a href=""https://twitter.com/GriffinMalone6/status/1291959372268990464"">Click Here</a>","Portland, Oregon","Portland, Metro, Multnomah County, Oregon, United States of America","45.5202471, -122.6741949, 0.0",45.5202471,-122.6741949
1093,Oregon,"<a href=""https://github.com/2020PB/police-brutality/blob/main/reports/Oregon.md"">Click Here</a>",Portland,Officers shove press during dispersal order,2020-08-07,August 7th,or-portland-244,"<a href=""https://twitter.com/R3volutionDaddy/status/1291652345613312000"">Click Here</a>","Portland, Oregon","Portland, Metro, Multnomah County, Oregon, United States of America","45.5202471, -122.6741949, 0.0",45.5202471,-122.6741949
1092,Oregon,"<a href=""https://github.com/2020PB/police-brutality/blob/main/reports/Oregon.md"">Click Here</a>",Portland,Officers grab and shove protesters,2020-08-07,August 7th,or-portland-243,"<a href=""https://twitter.com/GriffinMalone6/status/1291647242022137856"">Click Here</a>","Portland, Oregon","Portland, Metro, Multnomah County, Oregon, United States of America","45.5202471, -122.6741949, 0.0",45.5202471,-122.6741949
1096,Oregon,"<a href=""https://github.com/2020PB/police-brutality/blob/main/reports/Oregon.md"">Click Here</a>",Portland,Officers strike individual with batons,2020-08-07,August 7th,or-portland-251,"<a href=""https://twitter.com/danielvmedia/status/1292228819588452359"">Click Here</a>","Portland, Oregon","Portland, Metro, Multnomah County, Oregon, United States of America","45.5202471, -122.6741949, 0.0",45.5202471,-122.6741949
1091,Oregon,"<a href=""https://github.com/2020PB/police-brutality/blob/main/reports/Oregon.md"">Click Here</a>",Portland,Member of the press pepper sprayed,2020-08-07,August 7th,or-portland-242,"<a href=""https://twitter.com/GriffinMalone6/status/1291645839681576960"">Click Here</a>","Portland, Oregon","Portland, Metro, Multnomah County, Oregon, United States of America","45.5202471, -122.6741949, 0.0",45.5202471,-122.6741949
1097,Oregon,"<a href=""https://github.com/2020PB/police-brutality/blob/main/reports/Oregon.md"">Click Here</a>",Portland,"Individual held on the ground, pepper sprayed, punched, and arrested",2020-08-08,August 8th,or-portland-246,"<a href=""https://twitter.com/_WhatRiot/status/1292012255714787330"">Click Here</a>","Portland, Oregon","Portland, Metro, Multnomah County, Oregon, United States of America","45.5202471, -122.6741949, 0.0",45.5202471,-122.6741949
1101,Oregon,"<a href=""https://github.com/2020PB/police-brutality/blob/main/reports/Oregon.md"">Click Here</a>",Portland,Journalist shoved by police,2020-08-08,August 8th,or-portland-255,"<a href=""https://twitter.com/Shauna_Sowersby/status/1292354667901407232"">Click Here</a>","Portland, Oregon","Portland, Metro, Multnomah County, Oregon, United States of America","45.5202471, -122.6741949, 0.0",45.5202471,-122.6741949
55,Missouri,"<a href=""https://github.com/2020PB/police-brutality/blob/main/reports/Missouri.md"">Click Here</a>",Ferguson,"Police violently push, shove, and arrest protesters",2020-08-08,August 8th,mo-ferguson-1,"<a href=""https://twitter.com/ChuckModi1/status/1292669449624068096"">Click Here</a>","Ferguson, Missouri","Ferguson, Saint Louis County, Missouri, 63135, United States of America","38.744707, -90.3038975, 0.0",38.744707,-90.30389749999999
1098,Oregon,"<a href=""https://github.com/2020PB/police-brutality/blob/main/reports/Oregon.md"">Click Here</a>",Portland,Violent charge made by police,2020-08-08,August 8th,or-portland-248,"<a href=""https://twitter.com/R3volutionDaddy/status/1292023755502497792"">Click Here</a>","Portland, Oregon","Portland, Metro, Multnomah County, Oregon, United States of America","45.5202471, -122.6741949, 0.0",45.5202471,-122.6741949
1099,Oregon,"<a href=""https://github.com/2020PB/police-brutality/blob/main/reports/Oregon.md"">Click Here</a>",Portland,Police use tear gas and impact munitions against protesters,2020-08-08,August 8th,or-portland-252,"<a href=""https://twitter.com/KohzKah/status/1292352907367477249"">Click Here</a>","Portland, Oregon","Portland, Metro, Multnomah County, Oregon, United States of America","45.5202471, -122.6741949, 0.0",45.5202471,-122.6741949
1100,Oregon,"<a href=""https://github.com/2020PB/police-brutality/blob/main/reports/Oregon.md"">Click Here</a>",Portland,Journalist shot in arm,2020-08-08,August 8th,or-portland-254,"<a href=""https://twitter.com/suzettesmith/status/1292357734357069824"">Click Here</a>","Portland, Oregon","Portland, Metro, Multnomah County, Oregon, United States of America","45.5202471, -122.6741949, 0.0",45.5202471,-122.6741949
56,Missouri,"<a href=""https://github.com/2020PB/police-brutality/blob/main/reports/Missouri.md"">Click Here</a>",Ferguson,Police pepper spray media personel,2020-08-08,August 8th,mo-ferguson-2,"<a href=""https://twitter.com/ChuckModi1/status/1292675536527994880"">Click Here</a>","Ferguson, Missouri","Ferguson, Saint Louis County, Missouri, 63135, United States of America","38.744707, -90.3038975, 0.0",38.744707,-90.30389749999999
1103,Oregon,"<a href=""https://github.com/2020PB/police-brutality/blob/main/reports/Oregon.md"">Click Here</a>",Portland,Journalist shoved by police,2020-08-09,August 9th,or-portland-256,"<a href=""https://twitter.com/1misanthrophile/status/1292694939311017992"">Click Here</a>","Portland, Oregon","Portland, Metro, Multnomah County, Oregon, United States of America","45.5202471, -122.6741949, 0.0",45.5202471,-122.6741949
1102,Oregon,"<a href=""https://github.com/2020PB/police-brutality/blob/main/reports/Oregon.md"">Click Here</a>",Portland,Police throw explosives at crowd as they drive away,2020-08-09,August 9th,or-portland-253,"<a href=""https://twitter.com/Shauna_Sowersby/status/1292365400403881984"">Click Here</a>","Portland, Oregon","Portland, Metro, Multnomah County, Oregon, United States of America","45.5202471, -122.6741949, 0.0",45.5202471,-122.6741949
3,North Carolina,"<a href=""https://github.com/2020PB/police-brutality/blob/main/reports/North Carolina.md"">Click Here</a>",Asheville,Reporter for The Blade arrested at protest,2020-08-09,August 9th,nc-asheville-4,"<a href=""https://ashevilleblade.com/?p=3904"">Click Here</a>","Asheville, North Carolina","Asheville, Buncombe, North Carolina, United States of America","35.6009498, -82.5540161, 0.0",35.600949799999995,-82.5540161
1106,Oregon,"<a href=""https://github.com/2020PB/police-brutality/blob/main/reports/Oregon.md"">Click Here</a>",Portland,Police threaten journalist,2020-08-10,August 10th,or-portland-260,"<a href=""https://twitter.com/MrOlmos/status/1293073348444864513"">Click Here</a>","Portland, Oregon","Portland, Metro, Multnomah County, Oregon, United States of America","45.5202471, -122.6741949, 0.0",45.5202471,-122.6741949
1105,Oregon,"<a href=""https://github.com/2020PB/police-brutality/blob/main/reports/Oregon.md"">Click Here</a>",Portland,Police charge at protesters,2020-08-10,August 10th,or-portland-259,"<a href=""https://twitter.com/MrOlmos/status/1293069575597121536"">Click Here</a>","Portland, Oregon","Portland, Metro, Multnomah County, Oregon, United States of America","45.5202471, -122.6741949, 0.0",45.5202471,-122.6741949
1104,Oregon,"<a href=""https://github.com/2020PB/police-brutality/blob/main/reports/Oregon.md"">Click Here</a>",Portland,Bystander shot in the head,2020-08-10,August 10th,or-portland-257,"<a href=""https://twitter.com/Mestizo43/status/1292758596128665600"">Click Here</a>","Portland, Oregon","Portland, Metro, Multnomah County, Oregon, United States of America","45.5202471, -122.6741949, 0.0",45.5202471,-122.6741949
1107,Oregon,"<a href=""https://github.com/2020PB/police-brutality/blob/main/reports/Oregon.md"">Click Here</a>",Portland,Police shove members of the press,2020-08-11,August 11th,or-portland-261,"<a href=""https://twitter.com/matlockartist/status/1293113555101683714"">Click Here</a>","Portland, Oregon","Portland, Metro, Multnomah County, Oregon, United States of America","45.5202471, -122.6741949, 0.0",45.5202471,-122.6741949
325,Florida,"<a href=""https://github.com/2020PB/police-brutality/blob/main/reports/Florida.md"">Click Here</a>",Tampa,BLM Organizer hospitalized after officer kneels on her neck,2020-08-12,August 12th,fl-tampa-8,"<a href=""https://www.instagram.com/p/CDzyyQOAKEh/"">Click Here</a>","Tampa, Florida","Tampa, Hillsborough County, Florida, United States of America","27.9477595, -82.458444, 0.0",27.947759499999997,-82.458444
1108,Oregon,"<a href=""https://github.com/2020PB/police-brutality/blob/main/reports/Oregon.md"">Click Here</a>",Portland,Police shove and arrest protester,2020-08-12,August 12th,or-portland-269,"<a href=""https://twitter.com/hungrybowtie/status/1293804460309807104"">Click Here</a>","Portland, Oregon","Portland, Metro, Multnomah County, Oregon, United States of America","45.5202471, -122.6741949, 0.0",45.5202471,-122.6741949
735,Washington,"<a href=""https://github.com/2020PB/police-brutality/blob/main/reports/Washington.md"">Click Here</a>",Seattle,Police tackle protesters in street,2020-08-13,August 13th,wa-seattle-56,"<a href=""https://www.instagram.com/p/CD1oSRRA-R5/"">Click Here</a>","Seattle, Washington","Seattle, King County, Washington, United States of America","47.6038321, -122.3300624, 0.0",47.6038321,-122.3300624
1110,Oregon,"<a href=""https://github.com/2020PB/police-brutality/blob/main/reports/Oregon.md"">Click Here</a>",Portland,Police tear gas protesters,2020-08-13,August 13th,or-portland-265,"<a href=""https://twitter.com/MrOlmos/status/1293807939925417985"">Click Here</a>","Portland, Oregon","Portland, Metro, Multnomah County, Oregon, United States of America","45.5202471, -122.6741949, 0.0",45.5202471,-122.6741949
1109,Oregon,"<a href=""https://github.com/2020PB/police-brutality/blob/main/reports/Oregon.md"">Click Here</a>",Portland,Police assault protesters with batons,2020-08-13,August 13th,or-portland-264,"<a href=""https://twitter.com/MrOlmos/status/1293807939925417985"">Click Here</a>","Portland, Oregon","Portland, Metro, Multnomah County, Oregon, United States of America","45.5202471, -122.6741949, 0.0",45.5202471,-122.6741949
1111,Oregon,"<a href=""https://github.com/2020PB/police-brutality/blob/main/reports/Oregon.md"">Click Here</a>",Portland,"Police shove protesters on staircase, punch arrestee in stomach",2020-08-13,August 13th,or-portland-266,"<a href=""https://mobile.twitter.com/1misanthrophile/status/1293812124204978176"">Click Here</a>","Portland, Oregon","Portland, Metro, Multnomah County, Oregon, United States of America","45.5202471, -122.6741949, 0.0",45.5202471,-122.6741949
1112,Oregon,"<a href=""https://github.com/2020PB/police-brutality/blob/main/reports/Oregon.md"">Click Here</a>",Portland,Police slash tires of van,2020-08-13,August 13th,or-portland-267,"<a href=""https://mobile.twitter.com/IwriteOK/status/1293812356640735232"">Click Here</a>","Portland, Oregon","Portland, Metro, Multnomah County, Oregon, United States of America","45.5202471, -122.6741949, 0.0",45.5202471,-122.6741949
1113,Oregon,"<a href=""https://github.com/2020PB/police-brutality/blob/main/reports/Oregon.md"">Click Here</a>",Portland,Police throw protester to the ground,2020-08-13,August 13th,or-portland-268,"<a href=""https://mobile.twitter.com/Johnnthelefty/status/1293807313417957376"">Click Here</a>","Portland, Oregon","Portland, Metro, Multnomah County, Oregon, United States of America","45.5202471, -122.6741949, 0.0",45.5202471,-122.6741949
1116,Oregon,"<a href=""https://github.com/2020PB/police-brutality/blob/main/reports/Oregon.md"">Click Here</a>",Portland,Officer shoves stumbling protester,2020-08-14,August 14th,or-portland-273,"<a href=""https://twitter.com/MrOlmos/status/1294508631845552128"">Click Here</a>","Portland, Oregon","Portland, Metro, Multnomah County, Oregon, United States of America","45.5202471, -122.6741949, 0.0",45.5202471,-122.6741949
736,Washington,"<a href=""https://github.com/2020PB/police-brutality/blob/main/reports/Washington.md"">Click Here</a>",Seattle,Police damage vehicles supporting protesters,2020-08-14,August 14th,wa-seattle-57,"<a href=""https://twitter.com/RebellionBaby/status/1294535563110825985"">Click Here</a>","Seattle, Washington","Seattle, King County, Washington, United States of America","47.6038321, -122.3300624, 0.0",47.6038321,-122.3300624
1117,Oregon,"<a href=""https://github.com/2020PB/police-brutality/blob/main/reports/Oregon.md"">Click Here</a>",Portland,Officer shoves reporter,2020-08-14,August 14th,or-portland-274,"<a href=""https://twitter.com/hungrybowtie/status/1294530884587069440"">Click Here</a>","Portland, Oregon","Portland, Metro, Multnomah County, Oregon, United States of America","45.5202471, -122.6741949, 0.0",45.5202471,-122.6741949
1115,Oregon,"<a href=""https://github.com/2020PB/police-brutality/blob/main/reports/Oregon.md"">Click Here</a>",Portland,Officer stomps on protester trapped under shield,2020-08-14,August 14th,or-portland-286,"<a href=""https://twitter.com/danielvmedia/status/1294671439581212677"">Click Here</a>","Portland, Oregon","Portland, Metro, Multnomah County, Oregon, United States of America","45.5202471, -122.6741949, 0.0",45.5202471,-122.6741949
525,Washington DC,"<a href=""https://github.com/2020PB/police-brutality/blob/main/reports/Washington DC.md"">Click Here</a>",DC,Individual pepper sprayed while filming,2020-08-14,August 14th,dc-dc-29,"<a href=""https://twitter.com/rawsmedia/status/1294137999517655041"">Click Here</a>","DC, Washington DC","Washington, District of Columbia, 20230, United States of America","38.8949924, -77.0365581, 0.0",38.8949924,-77.0365581
1119,Oregon,"<a href=""https://github.com/2020PB/police-brutality/blob/main/reports/Oregon.md"">Click Here</a>",Portland,Officer shoves protester on the sidewalk,2020-08-14,August 14th,or-portland-276,"<a href=""https://twitter.com/1misanthrophile/status/1294507959553126400"">Click Here</a>","Portland, Oregon","Portland, Metro, Multnomah County, Oregon, United States of America","45.5202471, -122.6741949, 0.0",45.5202471,-122.6741949
1120,Oregon,"<a href=""https://github.com/2020PB/police-brutality/blob/main/reports/Oregon.md"">Click Here</a>",Portland,Police repeatedly shove drummer,2020-08-14,August 14th,or-portland-278,"<a href=""https://twitter.com/MrOlmos/status/1294507048663543808"">Click Here</a>","Portland, Oregon","Portland, Metro, Multnomah County, Oregon, United States of America","45.5202471, -122.6741949, 0.0",45.5202471,-122.6741949
1114,Oregon,"<a href=""https://github.com/2020PB/police-brutality/blob/main/reports/Oregon.md"">Click Here</a>",Portland,Police charge at and beat protesters with shields,2020-08-14,August 14th,or-portland-271,"<a href=""https://twitter.com/MrOlmos/status/1294506475809681409"">Click Here</a>","Portland, Oregon","Portland, Metro, Multnomah County, Oregon, United States of America","45.5202471, -122.6741949, 0.0",45.5202471,-122.6741949
526,Washington DC,"<a href=""https://github.com/2020PB/police-brutality/blob/main/reports/Washington DC.md"">Click Here</a>",DC,Protester grabbed and punched,2020-08-14,August 14th,dc-dc-30,"<a href=""https://twitter.com/ChuckModi1/status/1294497266250723328"">Click Here</a>","DC, Washington DC","Washington, District of Columbia, 20230, United States of America","38.8949924, -77.0365581, 0.0",38.8949924,-77.0365581
1118,Oregon,"<a href=""https://github.com/2020PB/police-brutality/blob/main/reports/Oregon.md"">Click Here</a>",Portland,Officer shove compliant protesters,2020-08-14,August 14th,or-portland-275,"<a href=""https://twitter.com/hungrybowtie/status/1294515890990411776"">Click Here</a>","Portland, Oregon","Portland, Metro, Multnomah County, Oregon, United States of America","45.5202471, -122.6741949, 0.0",45.5202471,-122.6741949
379,Illinois,"<a href=""https://github.com/2020PB/police-brutality/blob/main/reports/Illinois.md"">Click Here</a>",Chicago,Police shove and strike protesters,2020-08-15,August 15th,il-chicago-25,"<a href=""https://twitter.com/luz_mayancela/status/1294802015483318276"">Click Here</a>","Chicago, Illinois","Chicago, Cook County, Illinois, United States of America","41.8755616, -87.6244212, 0.0",41.875561600000005,-87.6244212
377,Illinois,"<a href=""https://github.com/2020PB/police-brutality/blob/main/reports/Illinois.md"">Click Here</a>",Chicago,Police shove and pepper spray protesters,2020-08-15,August 15th,il-chicago-23,"<a href=""https://twitter.com/ChicagoCritter/status/1294827198961061888"">Click Here</a>","Chicago, Illinois","Chicago, Cook County, Illinois, United States of America","41.8755616, -87.6244212, 0.0",41.875561600000005,-87.6244212
768,Georgia,"<a href=""https://github.com/2020PB/police-brutality/blob/main/reports/Georgia.md"">Click Here</a>",Stone Mountain,Officer shoves press,2020-08-15,August 15th,ga-stonemountain-1,"<a href=""https://twitter.com/matlockartist/status/1294827747059970049"">Click Here</a>","Stone Mountain, Georgia","Stone Mountain, DeKalb County, Georgia, 30087, United States of America","33.8062166, -84.1457505, 0.0",33.806216600000006,-84.1457505
384,Illinois,"<a href=""https://github.com/2020PB/police-brutality/blob/main/reports/Illinois.md"">Click Here</a>",Chicago,Police surround protesters and search their bags,2020-08-15,August 15th,il-chicago-30,"<a href=""https://twitter.com/DominicGwinn/status/1294792483772268550"">Click Here</a>","Chicago, Illinois","Chicago, Cook County, Illinois, United States of America","41.8755616, -87.6244212, 0.0",41.875561600000005,-87.6244212
