,state,edit_at,city,name,date,date_text,id,Link1,location,geocode,point,lon,lat
462,Minnesota,"<a href=""https://github.com/2020PB/police-brutality/blob/main/reports/Minnesota.md"">Click Here</a>",Minneapolis,"Man has his gun confiscated in an open carry state, violating his 2nd amendment rights",2020-05-26,May 26th,mn-minneapolis-28,"<a href=""https://www.facebook.com/damicedsota.thespiritflow/videos/10216865788705633/UzpfSTEwMDAxMTAzODkyNjEwMzpWSzoyNjczNDU4ODUyOTMzODE2/"">Click Here</a>","Minneapolis, Minnesota","Minneapolis, Hennepin County, Minnesota, United States of America","44.9772995, -93.2654692, 0.0",44.9772995,-93.2654692
461,Minnesota,"<a href=""https://github.com/2020PB/police-brutality/blob/main/reports/Minnesota.md"">Click Here</a>",Minneapolis,Police hit press in neck and head with wooden baton,2020-05-26,May 26th,mn-minneapolis-21,"<a href=""https://youtu.be/XAa5xb6JitI?t=5982"">Click Here</a>","Minneapolis, Minnesota","Minneapolis, Hennepin County, Minnesota, United States of America","44.9772995, -93.2654692, 0.0",44.9772995,-93.2654692
463,Minnesota,"<a href=""https://github.com/2020PB/police-brutality/blob/main/reports/Minnesota.md"">Click Here</a>",Minneapolis,Police shoot flashbang grenades into crowd,2020-05-26,believed to be May 26th or 27th,mn-minneapolis-14,"<a href=""https://www.facebook.com/1462345700/posts/10220863688809651"">Click Here</a>","Minneapolis, Minnesota","Minneapolis, Hennepin County, Minnesota, United States of America","44.9772995, -93.2654692, 0.0",44.9772995,-93.2654692
554,New York,"<a href=""https://github.com/2020PB/police-brutality/blob/main/reports/New York.md"">Click Here</a>",New York City,Police make violent arrest at Union Square,2020-05-28,May 28th,ny-newyorkcity-56,"<a href=""https://twitter.com/NY1/status/1266159669262893057"">Click Here</a>","New York City, New York","New York, United States of America","40.7127281, -74.0060152, 0.0",40.7127281,-74.0060152
149,Colorado,"<a href=""https://github.com/2020PB/police-brutality/blob/main/reports/Colorado.md"">Click Here</a>",Denver,Reporter shot with multiple pepper balls,2020-05-28,May 28th,co-denver-1,"<a href=""https://www.denverpost.com/2020/05/29/denver-post-photographer-pepper-balls-george-floyd-protest/"">Click Here</a>","Denver, Colorado","Denver, Denver County, Colorado, United States of America","39.7392364, -104.9848623, 0.0",39.7392364,-104.98486229999999
553,New York,"<a href=""https://github.com/2020PB/police-brutality/blob/main/reports/New York.md"">Click Here</a>",New York City,"Police make violent arrests, officer breaks baton striking protester",2020-05-28,May 28th,ny-newyorkcity-55,"<a href=""https://twitter.com/ShimonPro/status/1266136557871869952"">Click Here</a>","New York City, New York","New York, United States of America","40.7127281, -74.0060152, 0.0",40.7127281,-74.0060152
152,Colorado,"<a href=""https://github.com/2020PB/police-brutality/blob/main/reports/Colorado.md"">Click Here</a>",Denver,Denver SWAT shoot at woman trying to stop armored car,2020-05-29,May 29th,co-denver-4,"<a href=""https://twitter.com/DoughertyKMGH/status/1266560264918491138/video/1"">Click Here</a>","Denver, Colorado","Denver, Denver County, Colorado, United States of America","39.7392364, -104.9848623, 0.0",39.7392364,-104.98486229999999
26,Michigan,"<a href=""https://github.com/2020PB/police-brutality/blob/main/reports/Michigan.md"">Click Here</a>",Detroit,Officer charges through other officers to attack a protester who is backing away,2020-05-29,May 29th,mi-detroit-4,"<a href=""https://twitter.com/joeguillen/status/1266563974658744321"">Click Here</a>","Detroit, Michigan","Detroit, Wayne County, Michigan, United States of America","42.3315509, -83.0466403, 0.0",42.331550899999996,-83.04664029999999
27,Michigan,"<a href=""https://github.com/2020PB/police-brutality/blob/main/reports/Michigan.md"">Click Here</a>",Detroit,Riot police charge peaceful protesters,2020-05-29,May 29th,mi-detroit-5,"<a href=""https://twitter.com/julietmariaa/status/1266568356976635904"">Click Here</a>","Detroit, Michigan","Detroit, Wayne County, Michigan, United States of America","42.3315509, -83.0466403, 0.0",42.331550899999996,-83.04664029999999
418,Ohio,"<a href=""https://github.com/2020PB/police-brutality/blob/main/reports/Ohio.md"">Click Here</a>",Canton,"Police spray mace, fire tear gas and flashbangs at protesters, even after they have dispersed",2020-05-29,May 29th,oh-canton-1,"<a href=""https://www.facebook.com/dustin.j.teeters/videos/10157947506156001/"">Click Here</a>","Canton, Ohio","Canton, Stark County, Ohio, United States of America","40.7989522, -81.3784445, 0.0",40.7989522,-81.3784445
395,Iowa,"<a href=""https://github.com/2020PB/police-brutality/blob/main/reports/Iowa.md"">Click Here</a>",Des Moines,"Police repeatedly shoot tear gas into crowd, even after crowd has dispersed",2020-05-29,May 29th,ia-desmoines-2,"<a href=""https://www.kcci.com/article/developing-protesters-face-off-with-police-in-downtown-des-moines/32717301"">Click Here</a>","Des Moines, Iowa","Des Moines, Polk County, Iowa, United States of America","41.5910641, -93.6037149, 0.0",41.5910641,-93.60371490000001
150,Colorado,"<a href=""https://github.com/2020PB/police-brutality/blob/main/reports/Colorado.md"">Click Here</a>",Denver,Police pepper spray people trying to record,2020-05-29,May 29th,co-denver-2,"<a href=""https://twitter.com/greg_doucette/status/1266758227930333188"">Click Here</a>","Denver, Colorado","Denver, Denver County, Colorado, United States of America","39.7392364, -104.9848623, 0.0",39.7392364,-104.98486229999999
153,Colorado,"<a href=""https://github.com/2020PB/police-brutality/blob/main/reports/Colorado.md"">Click Here</a>",Denver,Police discharge tear gas into group of protesters,2020-05-29,May 29th,co-denver-13,"<a href=""https://www.reddit.com/r/Denver/comments/gslcxb/the_moment_the_cops_tear_gassed_the_protesters_at/"">Click Here</a>","Denver, Colorado","Denver, Denver County, Colorado, United States of America","39.7392364, -104.9848623, 0.0",39.7392364,-104.98486229999999
563,New York,"<a href=""https://github.com/2020PB/police-brutality/blob/main/reports/New York.md"">Click Here</a>",New York City,Police officer strikes protester,2020-05-29,May 29th,ny-newyorkcity-63,"<a href=""https://twitter.com/nateschweber/status/1266539107632758784"">Click Here</a>","New York City, New York","New York, United States of America","40.7127281, -74.0060152, 0.0",40.7127281,-74.0060152
151,Colorado,"<a href=""https://github.com/2020PB/police-brutality/blob/main/reports/Colorado.md"">Click Here</a>",Denver,Denver law enforcement shoot at reporters,2020-05-29,May 29th,co-denver-3,"<a href=""https://twitter.com/AdiGTV/status/1266554320717099008"">Click Here</a>","Denver, Colorado","Denver, Denver County, Colorado, United States of America","39.7392364, -104.9848623, 0.0",39.7392364,-104.98486229999999
758,Georgia,"<a href=""https://github.com/2020PB/police-brutality/blob/main/reports/Georgia.md"">Click Here</a>",Atlanta,Officer body slams woman onto ground,2020-05-29,May 29th,ga-atlanta-1,"<a href=""https://www.cnn.com/2020/06/05/us/atlanta-police-body-slam-woman/index.html"">Click Here</a>","Atlanta, Georgia","Atlanta, Georgia, United States of America","33.7490987, -84.3901849, 0.0",33.749098700000005,-84.39018490000001
330,Nevada,"<a href=""https://github.com/2020PB/police-brutality/blob/main/reports/Nevada.md"">Click Here</a>",Las Vegas,Police arrest a man for speaking at them from a distance,2020-05-29,May 29th,nv-lasvegas-3,"<a href=""https://twitter.com/itsraiialex/status/1266770032719040513"">Click Here</a>","Las Vegas, Nevada","Las Vegas, Clark County, Nevada, United States of America","36.1672559, -115.1485163, 0.0",36.1672559,-115.1485163
562,New York,"<a href=""https://github.com/2020PB/police-brutality/blob/main/reports/New York.md"">Click Here</a>",New York City,Police shove protester into the road,2020-05-29,May 29th,ny-newyorkcity-62,"<a href=""https://twitter.com/NickAtNews/status/1266567790095486976"">Click Here</a>","New York City, New York","New York, United States of America","40.7127281, -74.0060152, 0.0",40.7127281,-74.0060152
561,New York,"<a href=""https://github.com/2020PB/police-brutality/blob/main/reports/New York.md"">Click Here</a>",New York City,"Police chase and tackle protester, shove a second protester into a car",2020-05-29,May 29th,ny-newyorkcity-61,"<a href=""https://twitter.com/AnonymousBrook2/status/1266589590250553345"">Click Here</a>","New York City, New York","New York, United States of America","40.7127281, -74.0060152, 0.0",40.7127281,-74.0060152
759,Georgia,"<a href=""https://github.com/2020PB/police-brutality/blob/main/reports/Georgia.md"">Click Here</a>",Atlanta,Officer shoves a woman with his bike,2020-05-29,May 29th,ga-atlanta-2,"<a href=""https://twitter.com/ava/status/1266797973834395648"">Click Here</a>","Atlanta, Georgia","Atlanta, Georgia, United States of America","33.7490987, -84.3901849, 0.0",33.749098700000005,-84.39018490000001
559,New York,"<a href=""https://github.com/2020PB/police-brutality/blob/main/reports/New York.md"">Click Here</a>",New York City,Police shove protesters to the ground,2020-05-29,May 29th,ny-newyorkcity-59,"<a href=""https://twitter.com/mfstange/status/1266564340381036544"">Click Here</a>","New York City, New York","New York, United States of America","40.7127281, -74.0060152, 0.0",40.7127281,-74.0060152
564,New York,"<a href=""https://github.com/2020PB/police-brutality/blob/main/reports/New York.md"">Click Here</a>",New York City,Police officer shoves protesters,2020-05-29,May 29th,ny-newyorkcity-64,"<a href=""https://int.nyt.com/data/videotape/finished/2020/07/1594394863/0_id139-1254w.mp4"">Click Here</a>","New York City, New York","New York, United States of America","40.7127281, -74.0060152, 0.0",40.7127281,-74.0060152
560,New York,"<a href=""https://github.com/2020PB/police-brutality/blob/main/reports/New York.md"">Click Here</a>",New York City,Police shove and grab protesters,2020-05-29,May 29th,ny-newyorkcity-60,"<a href=""https://twitter.com/JohnPhilpNY/status/1266595992427790338"">Click Here</a>","New York City, New York","New York, United States of America","40.7127281, -74.0060152, 0.0",40.7127281,-74.0060152
331,Nevada,"<a href=""https://github.com/2020PB/police-brutality/blob/main/reports/Nevada.md"">Click Here</a>",Las Vegas,Police shove numerous protesters to the ground,2020-05-29,May 29th,nv-lasvegas-4,"<a href=""https://twitter.com/bridgetkbennett/status/1266561128185819136"">Click Here</a>","Las Vegas, Nevada","Las Vegas, Clark County, Nevada, United States of America","36.1672559, -115.1485163, 0.0",36.1672559,-115.1485163
275,California,"<a href=""https://github.com/2020PB/police-brutality/blob/main/reports/California.md"">Click Here</a>",San Jose,Police shoot a projectile at a protester,2020-05-29,May 29th,ca-sanjose-1,"<a href=""https://twitter.com/junkieanteater/status/1266603252839141377"">Click Here</a>","San Jose, California","San Jose, Santa Clara County, California, United States of America","37.3361905, -121.8905833, 0.0",37.3361905,-121.89058329999999
558,New York,"<a href=""https://github.com/2020PB/police-brutality/blob/main/reports/New York.md"">Click Here</a>",New York City,Police shove protester to the ground,2020-05-29,May 29th,ny-newyorkcity-58,"<a href=""https://twitter.com/nycDSA/status/1266562453686665217"">Click Here</a>","New York City, New York","New York, United States of America","40.7127281, -74.0060152, 0.0",40.7127281,-74.0060152
278,California,"<a href=""https://github.com/2020PB/police-brutality/blob/main/reports/California.md"">Click Here</a>",San Jose,Police knocks phone out of protester's hand; riot control measures follow,2020-05-29,May 29th,ca-sanjose-4,"<a href=""https://twitter.com/itssdelilahh/status/1266575145537163269"">Click Here</a>","San Jose, California","San Jose, Santa Clara County, California, United States of America","37.3361905, -121.8905833, 0.0",37.3361905,-121.89058329999999
432,Ohio,"<a href=""https://github.com/2020PB/police-brutality/blob/main/reports/Ohio.md"">Click Here</a>",Columbus,"Cop hits a protester in the face, escalates to whole crowd being pepper sprayed",2020-05-29,May 29th,oh-columbus-1,"<a href=""https://www.facebook.com/story.php?story_fbid=1137997739900780&id=100010716946743"">Click Here</a>","Columbus, Ohio","Columbus, Franklin County, Ohio, United States of America","39.9622601, -83.0007065, 0.0",39.9622601,-83.00070649999999
556,New York,"<a href=""https://github.com/2020PB/police-brutality/blob/main/reports/New York.md"">Click Here</a>",New York City,Police drive by man and hit him with car door,2020-05-29,May 29th,ny-newyorkcity-2,"<a href=""https://twitter.com/DriveWendys/status/1266555286678048770"">Click Here</a>","New York City, New York","New York, United States of America","40.7127281, -74.0060152, 0.0",40.7127281,-74.0060152
99,Texas,"<a href=""https://github.com/2020PB/police-brutality/blob/main/reports/Texas.md"">Click Here</a>",Houston,Officers shove a woman to the pavement,2020-05-29,May 29th,tx-houston-2,"<a href=""https://twitter.com/AbkTrauma/status/1266511972524269569"">Click Here</a>","Houston, Texas","Houston, Harris County, Texas, United States of America","29.7589382, -95.3676974, 0.0",29.7589382,-95.36769740000001
203,California,"<a href=""https://github.com/2020PB/police-brutality/blob/main/reports/California.md"">Click Here</a>",Los Angeles,Police use tear gas and riot rounds against protesters,2020-05-29,May 29th,ca-losangeles-37,"<a href=""https://vimeo.com/424352612"">Click Here</a>","Los Angeles, California","Los Angeles, Los Angeles County, California, United States of America","34.0536909, -118.2427666, 0.0",34.0536909,-118.2427666
62,Indiana,"<a href=""https://github.com/2020PB/police-brutality/blob/main/reports/Indiana.md"">Click Here</a>",Fort Wayne,Police pepper spray protesters attempting to record them,2020-05-29,May 29th,in-fortwayne-1,"<a href=""https://twitter.com/greg_doucette/status/1266745200656990208"">Click Here</a>","Fort Wayne, Indiana","Fort Wayne, Allen County, Indiana, United States of America","41.0799898, -85.1386015, 0.0",41.0799898,-85.13860150000001
98,Texas,"<a href=""https://github.com/2020PB/police-brutality/blob/main/reports/Texas.md"">Click Here</a>",Houston,Police trample protester with horse,2020-05-29,May 29th,tx-houston-1,"<a href=""https://twitter.com/vikthewild/status/1266538354939756544"">Click Here</a>","Houston, Texas","Houston, Harris County, Texas, United States of America","29.7589382, -95.3676974, 0.0",29.7589382,-95.36769740000001
555,New York,"<a href=""https://github.com/2020PB/police-brutality/blob/main/reports/New York.md"">Click Here</a>",New York City,"Police shove woman to the ground, inducing a seizure",2020-05-29,May 29th,ny-newyorkcity-1,"<a href=""https://twitter.com/whitney_hu/status/1266540710188195843"">Click Here</a>","New York City, New York","New York, United States of America","40.7127281, -74.0060152, 0.0",40.7127281,-74.0060152
63,Indiana,"<a href=""https://github.com/2020PB/police-brutality/blob/main/reports/Indiana.md"">Click Here</a>",Fort Wayne,Police tear gas journalist,2020-05-29,May 29th,in-fortwayne-6,"<a href=""https://pressfreedomtracker.us/all-incidents/wpta-journalist-hit-tear-gas-canister-while-covering-indiana-protest/"">Click Here</a>","Fort Wayne, Indiana","Fort Wayne, Allen County, Indiana, United States of America","41.0799898, -85.1386015, 0.0",41.0799898,-85.13860150000001
68,Indiana,"<a href=""https://github.com/2020PB/police-brutality/blob/main/reports/Indiana.md"">Click Here</a>",Indianapolis,Police confiscate medical supplies from medical station,2020-05-29,May 29th,in-indianapolis-1,"<a href=""https://www.facebook.com/AlexandraIndy/videos/10219444419838711"">Click Here</a>","Indianapolis, Indiana","Indianapolis, Marion, Indiana, United States of America","39.7683331, -86.1583502, 0.0",39.7683331,-86.1583502
557,New York,"<a href=""https://github.com/2020PB/police-brutality/blob/main/reports/New York.md"">Click Here</a>",New York City,Member of the New York State Assembly pepper-sprayed,2020-05-29,May 29th,ny-newyorkcity-3,"<a href=""https://www.cityandstateny.com/articles/politics/news-politics/even-black-lawmakers-get-pepper-sprayed.html"">Click Here</a>","New York City, New York","New York, United States of America","40.7127281, -74.0060152, 0.0",40.7127281,-74.0060152
276,California,"<a href=""https://github.com/2020PB/police-brutality/blob/main/reports/California.md"">Click Here</a>",San Jose,Officer puts knee on neck of protester,2020-05-29,May 29th,ca-sanjose-3,"<a href=""https://twitter.com/DeadByDawn101/status/1268825100385521665"">Click Here</a>","San Jose, California","San Jose, Santa Clara County, California, United States of America","37.3361905, -121.8905833, 0.0",37.3361905,-121.89058329999999
464,Minnesota,"<a href=""https://github.com/2020PB/police-brutality/blob/main/reports/Minnesota.md"">Click Here</a>",Minneapolis,Police force press and local business owner into store,2020-05-29,May 29th,mn-minneapolis-38,"<a href=""https://twitter.com/UR_Ninja/status/1266652249650016257"">Click Here</a>","Minneapolis, Minnesota","Minneapolis, Hennepin County, Minnesota, United States of America","44.9772995, -93.2654692, 0.0",44.9772995,-93.2654692
281,California,"<a href=""https://github.com/2020PB/police-brutality/blob/main/reports/California.md"">Click Here</a>",San Jose,"Man struck in face by police, severely injured",2020-05-29,May 29th,ca-sanjose-9,"<a href=""https://twitter.com/abc7newsbayarea/status/1266527253862719488"">Click Here</a>","San Jose, California","San Jose, Santa Clara County, California, United States of America","37.3361905, -121.8905833, 0.0",37.3361905,-121.89058329999999
280,California,"<a href=""https://github.com/2020PB/police-brutality/blob/main/reports/California.md"">Click Here</a>",San Jose,Woman shot in the head with foam round,2020-05-29,May 29th,ca-sanjose-8,"<a href=""https://abc7news.com/video/embed/?pid=6326456"">Click Here</a>","San Jose, California","San Jose, Santa Clara County, California, United States of America","37.3361905, -121.8905833, 0.0",37.3361905,-121.89058329999999
277,California,"<a href=""https://github.com/2020PB/police-brutality/blob/main/reports/California.md"">Click Here</a>",San Jose,Police fire on community activist,2020-05-29,May 29th,ca-sanjose-2,"<a href=""https://twitter.com/greg_doucette/status/1269267786792144898"">Click Here</a>","San Jose, California","San Jose, Santa Clara County, California, United States of America","37.3361905, -121.8905833, 0.0",37.3361905,-121.89058329999999
279,California,"<a href=""https://github.com/2020PB/police-brutality/blob/main/reports/California.md"">Click Here</a>",San Jose,Man struck by rubber bullet and explosive device,2020-05-29,May 29th,ca-sanjose-5,"<a href=""https://www.youtube.com/watch?v=89mUHzu3480"">Click Here</a>","San Jose, California","San Jose, Santa Clara County, California, United States of America","37.3361905, -121.8905833, 0.0",37.3361905,-121.89058329999999
821,Kentucky,"<a href=""https://github.com/2020PB/police-brutality/blob/main/reports/Kentucky.md"">Click Here</a>",Louisville,Police shoot at cars in traffic from overpass,2020-05-30,May 30th,ky-louisville-5,"<a href=""https://m.twitch.tv/tchcreigo/clip/GentleRelentlessWalrusPoooound"">Click Here</a>","Louisville, Kentucky","Louisville, Jefferson County, Kentucky, United States of America","38.2542376, -85.759407, 0.0",38.254237599999996,-85.759407
847,Oregon,"<a href=""https://github.com/2020PB/police-brutality/blob/main/reports/Oregon.md"">Click Here</a>",Eugene,Peaceful protester tear gassed,2020-05-30,May 30th,or-eugene-2,"<a href=""https://www.youtube.com/watch?v=dPTr54DdTdY"">Click Here</a>","Eugene, Oregon","Eugene, Lane County, Oregon, United States of America","44.0505054, -123.0950506, 0.0",44.0505054,-123.09505060000001
72,Texas,"<a href=""https://github.com/2020PB/police-brutality/blob/main/reports/Texas.md"">Click Here</a>",Austin,Police assault protesters,2020-05-30,May 30th,tx-austin-2,"<a href=""https://gfycat.com/tautimaginativedore"">Click Here</a>","Austin, Texas","Austin, Travis County, Texas, United States of America","30.2711286, -97.7436995, 0.0",30.2711286,-97.7436995
852,Oregon,"<a href=""https://github.com/2020PB/police-brutality/blob/main/reports/Oregon.md"">Click Here</a>",Portland,Police violently break up peaceful protest,2020-05-30,May 30th,or-portland-1,"<a href=""https://twitter.com/IwriteOK/status/1266907719635632129"">Click Here</a>","Portland, Oregon","Portland, Metro, Multnomah County, Oregon, United States of America","45.5202471, -122.6741949, 0.0",45.5202471,-122.6741949
811,Arizona,"<a href=""https://github.com/2020PB/police-brutality/blob/main/reports/Arizona.md"">Click Here</a>",Phoenix,Officer tackles and arrests person walking home from protest,2020-05-30,May 30th,az-phoenix-1,"<a href=""https://twitter.com/PhxProtestLIVE/status/1268390978571825156?s=20"">Click Here</a>","Phoenix, Arizona","Phoenix, Maricopa County, Arizona, United States of America","33.4484367, -112.0741417, 0.0",33.448436699999995,-112.07414170000001
761,Georgia,"<a href=""https://github.com/2020PB/police-brutality/blob/main/reports/Georgia.md"">Click Here</a>",Atlanta,"Police punch man on the ground, then tackle woman to ground who objects",2020-05-30,May 30th,ga-atlanta-4,"<a href=""https://twitter.com/ANGELCUCCl/status/1266939757252280321"">Click Here</a>","Atlanta, Georgia","Atlanta, Georgia, United States of America","33.7490987, -84.3901849, 0.0",33.749098700000005,-84.39018490000001
16,North Carolina,"<a href=""https://github.com/2020PB/police-brutality/blob/main/reports/North Carolina.md"">Click Here</a>",Raleigh,Police fire tear gas at peaceful protests,2020-05-30,May 30th,nc-raleigh-2,"<a href=""https://www.newsobserver.com/news/local/article243114301.html"">Click Here</a>","Raleigh, North Carolina","Raleigh, Wake County, North Carolina, United States of America","35.7803977, -78.6390989, 0.0",35.7803977,-78.63909890000001
760,Georgia,"<a href=""https://github.com/2020PB/police-brutality/blob/main/reports/Georgia.md"">Click Here</a>",Atlanta,"Cops pull people out of their car, tase them",2020-05-30,May 30th,ga-atlanta-3,"<a href=""https://twitter.com/danielvankirk/status/1266947767840063489"">Click Here</a>","Atlanta, Georgia","Atlanta, Georgia, United States of America","33.7490987, -84.3901849, 0.0",33.749098700000005,-84.39018490000001
762,Georgia,"<a href=""https://github.com/2020PB/police-brutality/blob/main/reports/Georgia.md"">Click Here</a>",Atlanta,Photographer tackled to the ground by four police officers,2020-05-30,May 30th,ga-atlanta-5,"<a href=""https://twitter.com/DanWolken/status/1266877753015570433"">Click Here</a>","Atlanta, Georgia","Atlanta, Georgia, United States of America","33.7490987, -84.3901849, 0.0",33.749098700000005,-84.39018490000001
94,Texas,"<a href=""https://github.com/2020PB/police-brutality/blob/main/reports/Texas.md"">Click Here</a>",Dallas,Police use flashbangs and tear gas on protesters,2020-05-30,May 30th,tx-dallas-2,"<a href=""https://twitter.com/xtranai/status/1266898175568338945"">Click Here</a>","Dallas, Texas","Dallas, Dallas County, Texas, United States of America","32.7762719, -96.7968559, 0.0",32.7762719,-96.7968559
28,Michigan,"<a href=""https://github.com/2020PB/police-brutality/blob/main/reports/Michigan.md"">Click Here</a>",Detroit,Police shove and scream at men walking down the street,2020-05-30,May 30th,mi-detroit-1,"<a href=""https://twitter.com/AkramG03/status/1266876680142049282"">Click Here</a>","Detroit, Michigan","Detroit, Wayne County, Michigan, United States of America","42.3315509, -83.0466403, 0.0",42.331550899999996,-83.04664029999999
64,Indiana,"<a href=""https://github.com/2020PB/police-brutality/blob/main/reports/Indiana.md"">Click Here</a>",Fort Wayne,Police tear gas peaceful protesters,2020-05-30,May 30th,in-fortwayne-2,"<a href=""https://twitter.com/blazedyukhei/status/1266533569029177346"">Click Here</a>","Fort Wayne, Indiana","Fort Wayne, Allen County, Indiana, United States of America","41.0799898, -85.1386015, 0.0",41.0799898,-85.13860150000001
93,Texas,"<a href=""https://github.com/2020PB/police-brutality/blob/main/reports/Texas.md"">Click Here</a>",Dallas,Man shot in the eye,2020-05-30,May 30th,tx-dallas-4,"<a href=""https://twitter.com/HERCGTH/status/1266870616570900480"">Click Here</a>","Dallas, Texas","Dallas, Dallas County, Texas, United States of America","32.7762719, -96.7968559, 0.0",32.7762719,-96.7968559
73,Texas,"<a href=""https://github.com/2020PB/police-brutality/blob/main/reports/Texas.md"">Click Here</a>",Austin,Police shoot non-violent protester in the head,2020-05-30,May 30th,tx-austin-3,"<a href=""https://www.reddit.com/r/PublicFreakout/comments/guwc4y/austin_tx_nonviolent_protestor_shot_in_the_head/"">Click Here</a>","Austin, Texas","Austin, Travis County, Texas, United States of America","30.2711286, -97.7436995, 0.0",30.2711286,-97.7436995
819,Kentucky,"<a href=""https://github.com/2020PB/police-brutality/blob/main/reports/Kentucky.md"">Click Here</a>",Louisville,Police shoot young woman in the head with a rubber bullet,2020-05-30,May 30th,ky-louisville-4,"<a href=""https://i.imgur.com/1KGZsXW.mp4"">Click Here</a>","Louisville, Kentucky","Louisville, Jefferson County, Kentucky, United States of America","38.2542376, -85.759407, 0.0",38.254237599999996,-85.759407
572,New York,"<a href=""https://github.com/2020PB/police-brutality/blob/main/reports/New York.md"">Click Here</a>",New York City,Reporter is arrested and detained for 6 hours,2020-05-30,May 30th,ny-newyorkcity-30,"<a href=""https://www.advocate.com/news/2020/6/01/journalist-keith-boykin-arrested-nyc-protest-held-six-hours"">Click Here</a>","New York City, New York","New York, United States of America","40.7127281, -74.0060152, 0.0",40.7127281,-74.0060152
