,state,edit_at,city,name,date,date_text,id,Link1,location,geocode,point,lon,lat
585,New York,"<a href=""https://github.com/2020PB/police-brutality/blob/main/reports/New York.md"">Click Here</a>",New York City,Protesters with hands up assaulted by police,2020-05-31,May 31st,ny-newyorkcity-15,"<a href=""https://www.reddit.com/r/2020PoliceBrutality/comments/gu2u28/more_documented_aggression_in_flatbush_brooklyn/"">Click Here</a>","New York City, New York","New York, United States of America","40.7127281, -74.0060152, 0.0",40.7127281,-74.0060152
587,New York,"<a href=""https://github.com/2020PB/police-brutality/blob/main/reports/New York.md"">Click Here</a>",New York City,Officers beat man until his face and belongings are bloody,2020-05-31,May 31st,ny-newyorkcity-17,"<a href=""https://wapo.st/2Mx7WY6"">Click Here</a>","New York City, New York","New York, United States of America","40.7127281, -74.0060152, 0.0",40.7127281,-74.0060152
588,New York,"<a href=""https://github.com/2020PB/police-brutality/blob/main/reports/New York.md"">Click Here</a>",New York City,NYPD denies 6th amendment rights to protesters,2020-05-31,May 31st,ny-newyorkcity-29,"<a href=""https://twitter.com/GoodCallNYC/status/1267128759951523846"">Click Here</a>","New York City, New York","New York, United States of America","40.7127281, -74.0060152, 0.0",40.7127281,-74.0060152
589,New York,"<a href=""https://github.com/2020PB/police-brutality/blob/main/reports/New York.md"">Click Here</a>",New York City,Police charge at peaceful crowd,2020-05-31,May 31st,ny-newyorkcity-31,"<a href=""https://twitter.com/drivenbyboredom/status/1267263490009546753"">Click Here</a>","New York City, New York","New York, United States of America","40.7127281, -74.0060152, 0.0",40.7127281,-74.0060152
590,New York,"<a href=""https://github.com/2020PB/police-brutality/blob/main/reports/New York.md"">Click Here</a>",New York City,Multiple police officers assault woman,2020-05-31,May 31st,ny-newyorkcity-48,"<a href=""https://twitter.com/greg_doucette/status/1268025470764888066"">Click Here</a>","New York City, New York","New York, United States of America","40.7127281, -74.0060152, 0.0",40.7127281,-74.0060152
591,New York,"<a href=""https://github.com/2020PB/police-brutality/blob/main/reports/New York.md"">Click Here</a>",New York City,Police chase and beat protesters,2020-05-31,May 31st,ny-newyorkcity-42,"<a href=""https://twitter.com/brandon212_/status/1267184037547986944"">Click Here</a>","New York City, New York","New York, United States of America","40.7127281, -74.0060152, 0.0",40.7127281,-74.0060152
595,New York,"<a href=""https://github.com/2020PB/police-brutality/blob/main/reports/New York.md"">Click Here</a>",New York City,Police officer pepper sprays protesters across barricade,2020-05-31,May 31st,ny-newyorkcity-85,"<a href=""https://int.nyt.com/data/videotape/finished/2020/07/1594394781/0_id34-1254w.mp4"">Click Here</a>","New York City, New York","New York, United States of America","40.7127281, -74.0060152, 0.0",40.7127281,-74.0060152
592,New York,"<a href=""https://github.com/2020PB/police-brutality/blob/main/reports/New York.md"">Click Here</a>",New York City,Police pepper spray and assault protesters,2020-05-31,May 31st,ny-newyorkcity-82,"<a href=""https://twitter.com/DavidASiffert/status/1267297196157947904"">Click Here</a>","New York City, New York","New York, United States of America","40.7127281, -74.0060152, 0.0",40.7127281,-74.0060152
814,Arizona,"<a href=""https://github.com/2020PB/police-brutality/blob/main/reports/Arizona.md"">Click Here</a>",Phoenix,Officer arrests a woman on the sidewalk outside her home for curfew violation,2020-05-31,May 31st,az-phoenix-3,"<a href=""https://www.azcentral.com/story/news/local/phoenix/2020/06/01/residents-phoenix-garfield-neighborhood-say-police-not-protesters-were-problem-protest/5312347002/?utm_campaign=snd-autopilot&cid=twitter_azcentral"">Click Here</a>","Phoenix, Arizona","Phoenix, Maricopa County, Arizona, United States of America","33.4484367, -112.0741417, 0.0",33.448436699999995,-112.07414170000001
593,New York,"<a href=""https://github.com/2020PB/police-brutality/blob/main/reports/New York.md"">Click Here</a>",New York City,Several violent arrests made by police,2020-05-31,May 31st,ny-newyorkcity-83,"<a href=""https://twitter.com/jangelooff/status/1267287782155857923"">Click Here</a>","New York City, New York","New York, United States of America","40.7127281, -74.0060152, 0.0",40.7127281,-74.0060152
457,Connecticut,"<a href=""https://github.com/2020PB/police-brutality/blob/main/reports/Connecticut.md"">Click Here</a>",Waterbury,Police tackle and detain 6 protesters,2020-05-31,May 31st,ct-waterbury-2,"<a href=""https://twitter.com/mattaustinTV/status/1267189278691528706"">Click Here</a>","Waterbury, Connecticut","Waterbury, New Haven County, Connecticut, United States of America","41.5538091, -73.0438362, 0.0",41.5538091,-73.0438362
583,New York,"<a href=""https://github.com/2020PB/police-brutality/blob/main/reports/New York.md"">Click Here</a>",New York City,Police assault protesters,2020-05-31,May 31st,ny-newyorkcity-11,"<a href=""https://twitter.com/theactivistTati/status/1266889419858075649"">Click Here</a>","New York City, New York","New York, United States of America","40.7127281, -74.0060152, 0.0",40.7127281,-74.0060152
586,New York,"<a href=""https://github.com/2020PB/police-brutality/blob/main/reports/New York.md"">Click Here</a>",New York City,Police injure journalist,2020-05-31,May 31st,ny-newyorkcity-16,"<a href=""https://twitter.com/tylergabriel_/status/1267287516345925632"">Click Here</a>","New York City, New York","New York, United States of America","40.7127281, -74.0060152, 0.0",40.7127281,-74.0060152
499,Washington DC,"<a href=""https://github.com/2020PB/police-brutality/blob/main/reports/Washington DC.md"">Click Here</a>",DC,NBC News reporter shot on air,2020-05-31,May 31st,dc-dc-40,"<a href=""https://twitter.com/MSNBC/status/1267294124123750402"">Click Here</a>","DC, Washington DC","Washington, District of Columbia, 20230, United States of America","38.8949924, -77.0365581, 0.0",38.8949924,-77.0365581
491,Minnesota,"<a href=""https://github.com/2020PB/police-brutality/blob/main/reports/Minnesota.md"">Click Here</a>",Minneapolis,Police shoot impact munitions at French news team and arrest them,2020-05-31,May 31st,mn-minneapolis-33,"<a href=""https://twitter.com/MatDerrien/status/1267095983084777472"">Click Here</a>","Minneapolis, Minnesota","Minneapolis, Hennepin County, Minnesota, United States of America","44.9772995, -93.2654692, 0.0",44.9772995,-93.2654692
478,Minnesota,"<a href=""https://github.com/2020PB/police-brutality/blob/main/reports/Minnesota.md"">Click Here</a>",Minneapolis,Police shoot at a woman on her porch,2020-05-31,May 31st,mn-minneapolis-2,"<a href=""https://twitter.com/tkerssen/status/1266921821653385225"">Click Here</a>","Minneapolis, Minnesota","Minneapolis, Hennepin County, Minnesota, United States of America","44.9772995, -93.2654692, 0.0",44.9772995,-93.2654692
479,Minnesota,"<a href=""https://github.com/2020PB/police-brutality/blob/main/reports/Minnesota.md"">Click Here</a>",Minneapolis,LA Times employee recounts getting shot,2020-05-31,May 31st,mn-minneapolis-6,"<a href=""https://twitter.com/mollyhf/status/1266911382613692422"">Click Here</a>","Minneapolis, Minnesota","Minneapolis, Hennepin County, Minnesota, United States of America","44.9772995, -93.2654692, 0.0",44.9772995,-93.2654692
823,Kentucky,"<a href=""https://github.com/2020PB/police-brutality/blob/main/reports/Kentucky.md"">Click Here</a>",Louisville,5 police officers use batons to beat protester,2020-05-31,May 31st,ky-louisville-9,"<a href=""https://wfpl.org/wp-content/uploads/2020/06/File-169x300.jpg"">Click Here</a>","Louisville, Kentucky","Louisville, Jefferson County, Kentucky, United States of America","38.2542376, -85.759407, 0.0",38.254237599999996,-85.759407
480,Minnesota,"<a href=""https://github.com/2020PB/police-brutality/blob/main/reports/Minnesota.md"">Click Here</a>",Minneapolis,Reporter's car window broken by police projectile,2020-05-31,May 31st,mn-minneapolis-7,"<a href=""https://twitter.com/JaredGoyette/status/1266961243476299778"">Click Here</a>","Minneapolis, Minnesota","Minneapolis, Hennepin County, Minnesota, United States of America","44.9772995, -93.2654692, 0.0",44.9772995,-93.2654692
482,Minnesota,"<a href=""https://github.com/2020PB/police-brutality/blob/main/reports/Minnesota.md"">Click Here</a>",Minneapolis,CBS news crew shot with rubber bullets,2020-05-31,May 31st,mn-minneapolis-9,"<a href=""https://mobile.twitter.com/chadloder/status/1266971884001693696"">Click Here</a>","Minneapolis, Minnesota","Minneapolis, Hennepin County, Minnesota, United States of America","44.9772995, -93.2654692, 0.0",44.9772995,-93.2654692
483,Minnesota,"<a href=""https://github.com/2020PB/police-brutality/blob/main/reports/Minnesota.md"">Click Here</a>",Minneapolis,Police throw flashbangs at reporter,2020-05-31,May 31st,mn-minneapolis-10,"<a href=""https://twitter.com/atrupar/status/1266910910137995264"">Click Here</a>","Minneapolis, Minnesota","Minneapolis, Hennepin County, Minnesota, United States of America","44.9772995, -93.2654692, 0.0",44.9772995,-93.2654692
484,Minnesota,"<a href=""https://github.com/2020PB/police-brutality/blob/main/reports/Minnesota.md"">Click Here</a>",Minneapolis,Police blind a reporter with rubber bullet,2020-05-31,May 31st,mn-minneapolis-11,"<a href=""https://mobile.twitter.com/KillerMartinis/status/1266618525600399361?s=19"">Click Here</a>","Minneapolis, Minnesota","Minneapolis, Hennepin County, Minnesota, United States of America","44.9772995, -93.2654692, 0.0",44.9772995,-93.2654692
492,Minnesota,"<a href=""https://github.com/2020PB/police-brutality/blob/main/reports/Minnesota.md"">Click Here</a>",Minneapolis,Minnesota state patrol fire tear gas and impact munitions at press,2020-05-31,May 31st,mn-minneapolis-34,"<a href=""https://www.cnn.com/videos/us/2020/05/31/omar-jimenez-minneapolis-protest-george-floyd-vpx.cnn"">Click Here</a>","Minneapolis, Minnesota","Minneapolis, Hennepin County, Minnesota, United States of America","44.9772995, -93.2654692, 0.0",44.9772995,-93.2654692
486,Minnesota,"<a href=""https://github.com/2020PB/police-brutality/blob/main/reports/Minnesota.md"">Click Here</a>",Minneapolis,"Police shoot at, threaten to arrest reporter",2020-05-31,May 31st,mn-minneapolis-13,"<a href=""https://www.youtube.com/watch?v=NN8ISwuiX68"">Click Here</a>","Minneapolis, Minnesota","Minneapolis, Hennepin County, Minnesota, United States of America","44.9772995, -93.2654692, 0.0",44.9772995,-93.2654692
487,Minnesota,"<a href=""https://github.com/2020PB/police-brutality/blob/main/reports/Minnesota.md"">Click Here</a>",Minneapolis,Police stop SUV to drive-by pepper-spray protesters through window,2020-05-31,May 31st,mn-minneapolis-17,"<a href=""https://twitter.com/keycodez/status/1267235529311113216/video/1"">Click Here</a>","Minneapolis, Minnesota","Minneapolis, Hennepin County, Minnesota, United States of America","44.9772995, -93.2654692, 0.0",44.9772995,-93.2654692
488,Minnesota,"<a href=""https://github.com/2020PB/police-brutality/blob/main/reports/Minnesota.md"">Click Here</a>",Minneapolis,Patient care assistant reports being shot with rubber bullets while treating injured protesters,2020-05-31,May 31st,mn-minneapolis-18,"<a href=""https://mobile.twitter.com/chadloder/status/1266957030285127687"">Click Here</a>","Minneapolis, Minnesota","Minneapolis, Hennepin County, Minnesota, United States of America","44.9772995, -93.2654692, 0.0",44.9772995,-93.2654692
489,Minnesota,"<a href=""https://github.com/2020PB/police-brutality/blob/main/reports/Minnesota.md"">Click Here</a>",Minneapolis,Journalists pepper sprayed and hit with flashbangs and batons,2020-05-31,May 31st,mn-minneapolis-19,"<a href=""https://twitter.com/edouphoto/status/1267958349477249024"">Click Here</a>","Minneapolis, Minnesota","Minneapolis, Hennepin County, Minnesota, United States of America","44.9772995, -93.2654692, 0.0",44.9772995,-93.2654692
481,Minnesota,"<a href=""https://github.com/2020PB/police-brutality/blob/main/reports/Minnesota.md"">Click Here</a>",Minneapolis,Police slashes tires,2020-05-31,May 31st,mn-minneapolis-8,"<a href=""https://www.motherjones.com/anti-racism-police-protest/2020/06/videos-show-cops-slashing-car-tires-at-protests-in-minneapolis/"">Click Here</a>","Minneapolis, Minnesota","Minneapolis, Hennepin County, Minnesota, United States of America","44.9772995, -93.2654692, 0.0",44.9772995,-93.2654692
822,Kentucky,"<a href=""https://github.com/2020PB/police-brutality/blob/main/reports/Kentucky.md"">Click Here</a>",Louisville,Police smashing water bottles,2020-05-31,May 31st,ky-louisville-1,"<a href=""https://twitter.com/nataliealund/status/1266877181164089349"">Click Here</a>","Louisville, Kentucky","Louisville, Jefferson County, Kentucky, United States of America","38.2542376, -85.759407, 0.0",38.254237599999996,-85.759407
498,Washington DC,"<a href=""https://github.com/2020PB/police-brutality/blob/main/reports/Washington DC.md"">Click Here</a>",DC,Police tear gas protesters outside of Lafayette Square,2020-05-31,May 31st,dc-dc-11,"<a href=""https://twitter.com/i/status/1267298316141899780"">Click Here</a>","DC, Washington DC","Washington, District of Columbia, 20230, United States of America","38.8949924, -77.0365581, 0.0",38.8949924,-77.0365581
485,Minnesota,"<a href=""https://github.com/2020PB/police-brutality/blob/main/reports/Minnesota.md"">Click Here</a>",Minneapolis,Police shoot Reuters reporters with rubber bullets,2020-05-31,May 31st,mn-minneapolis-12,"<a href=""https://www.reuters.com/article/us-minneapolis-police-protest-update/reuters-cameraman-hit-by-rubber-bullets-as-police-disperse-protesters-idUSKBN237050"">Click Here</a>","Minneapolis, Minnesota","Minneapolis, Hennepin County, Minnesota, United States of America","44.9772995, -93.2654692, 0.0",44.9772995,-93.2654692
225,California,"<a href=""https://github.com/2020PB/police-brutality/blob/main/reports/California.md"">Click Here</a>",Los Angeles,Business owner flags down police for protection from looters; she is arrested,2020-06-01,June 1st,ca-losangeles-26,"<a href=""https://www.cbsnews.com/news/police-handcuff-good-samaritans-protect-store-looters/"">Click Here</a>","Los Angeles, California","Los Angeles, Los Angeles County, California, United States of America","34.0536909, -118.2427666, 0.0",34.0536909,-118.2427666
43,Michigan,"<a href=""https://github.com/2020PB/police-brutality/blob/main/reports/Michigan.md"">Click Here</a>",Kalamazoo,Police fire tear gas at prone protesters,2020-06-01,June 1st,mi-kalamazoo-1,"<a href=""https://twitter.com/i/status/1267677463850745858"">Click Here</a>","Kalamazoo, Michigan","Kalamazoo, Kalamazoo County, Michigan, United States of America","42.291707, -85.5872286, 0.0",42.291707,-85.5872286
290,California,"<a href=""https://github.com/2020PB/police-brutality/blob/main/reports/California.md"">Click Here</a>",Vallejo,Police fatally shoot unarmed 22 year old,2020-06-01,June 1st,ca-vallejo-1,"<a href=""https://www.theguardian.com/us-news/2020/jun/04/vallejo-police-kill-unarmed-man-california"">Click Here</a>","Vallejo, California","Vallejo, Solano County, California, United States of America","38.1040864, -122.2566367, 0.0",38.1040864,-122.25663670000002
416,Ohio,"<a href=""https://github.com/2020PB/police-brutality/blob/main/reports/Ohio.md"">Click Here</a>",Beavercreek,Police use tear gas on protesters peacefully blocking road,2020-06-01,June 1st,oh-beavercreek-1,"<a href=""https://www.facebook.com/daytondailynews/videos/203371377358112"">Click Here</a>","Beavercreek, Ohio","Beavercreek, Greene County, Ohio, United States of America","39.7092262, -84.0632685, 0.0",39.7092262,-84.0632685
689,Washington,"<a href=""https://github.com/2020PB/police-brutality/blob/main/reports/Washington.md"">Click Here</a>",Seattle,Police strike active news crew with tear gas,2020-06-01,June 1st,wa-seattle-10,"<a href=""https://twitter.com/Acyn/status/1267673936659021830?s=20"">Click Here</a>","Seattle, Washington","Seattle, King County, Washington, United States of America","47.6038321, -122.3300624, 0.0",47.6038321,-122.3300624
366,Illinois,"<a href=""https://github.com/2020PB/police-brutality/blob/main/reports/Illinois.md"">Click Here</a>",Chicago,Police grab protester and throw into brick wall,2020-06-01,June 1st,il-chicago-12,"<a href=""https://twitter.com/ChrisDitton/status/1267675836892708864"">Click Here</a>","Chicago, Illinois","Chicago, Cook County, Illinois, United States of America","41.8755616, -87.6244212, 0.0",41.875561600000005,-87.6244212
365,Illinois,"<a href=""https://github.com/2020PB/police-brutality/blob/main/reports/Illinois.md"">Click Here</a>",Chicago,CPD chase down protester on TV,2020-06-01,June 1st,il-chicago-8,"<a href=""https://twitter.com/BLMChi/status/1267486699321544704"">Click Here</a>","Chicago, Illinois","Chicago, Cook County, Illinois, United States of America","41.8755616, -87.6244212, 0.0",41.875561600000005,-87.6244212
392,Utah,"<a href=""https://github.com/2020PB/police-brutality/blob/main/reports/Utah.md"">Click Here</a>",Salt Lake City,Police push and tackle man that is being vocal,2020-06-01,June 1st,ut-saltlakecity-3,"<a href=""https://v.redd.it/fl4y919v1q251"">Click Here</a>","Salt Lake City, Utah","Salt Lake City, Salt Lake County, Utah, United States of America","40.7596198, -111.8867975, 0.0",40.759619799999996,-111.88679750000001
757,Georgia,"<a href=""https://github.com/2020PB/police-brutality/blob/main/reports/Georgia.md"">Click Here</a>",Athens,Police fire tear gas at peaceful protest,2020-06-01,June 1st,ga-athens-1,"<a href=""https://twitter.com/greg_doucette/status/1267978682951491585"">Click Here</a>","Athens, Georgia","Athens, Athens-Clarke County, Georgia, 303341458, United States of America","33.9597677, -83.376398, 0.0",33.9597677,-83.376398
690,Washington,"<a href=""https://github.com/2020PB/police-brutality/blob/main/reports/Washington.md"">Click Here</a>",Seattle,Police injure sleeping homeless man with flashbang,2020-06-01,June 1st,wa-seattle-54,"<a href=""https://www.facebook.com/kg.farmer/videos/278656296661372"">Click Here</a>","Seattle, Washington","Seattle, King County, Washington, United States of America","47.6038321, -122.3300624, 0.0",47.6038321,-122.3300624
400,Iowa,"<a href=""https://github.com/2020PB/police-brutality/blob/main/reports/Iowa.md"">Click Here</a>",Des Moines,Police pepper spray Des Moines Register reporter even as she repeatedly announced herself as press,2020-06-01,June 1st,ia-desmoines-4,"<a href=""https://twitter.com/katie_akin/status/1267694434847731713"">Click Here</a>","Des Moines, Iowa","Des Moines, Polk County, Iowa, United States of America","41.5910641, -93.6037149, 0.0",41.5910641,-93.60371490000001
688,Washington,"<a href=""https://github.com/2020PB/police-brutality/blob/main/reports/Washington.md"">Click Here</a>",Seattle,Police pepper spray crowd,2020-06-01,June 1st,wa-seattle-9,"<a href=""https://www.reddit.com/r/Seattle/comments/gv0ru3/this_is_the_moment_it_all_happened/"">Click Here</a>","Seattle, Washington","Seattle, King County, Washington, United States of America","47.6038321, -122.3300624, 0.0",47.6038321,-122.3300624
412,Nebraska,"<a href=""https://github.com/2020PB/police-brutality/blob/main/reports/Nebraska.md"">Click Here</a>",Omaha,Peaceful protesters arrested for breaking curfew,2020-06-01,June 1,ne-omaha-2,"<a href=""https://twitter.com/reecereports/status/1267629669093978117"">Click Here</a>","Omaha, Nebraska","Omaha, Douglas County, Nebraska, United States of America","41.2587459, -95.9383758, 0.0",41.258745899999994,-95.93837579999999
344,Wisconsin,"<a href=""https://github.com/2020PB/police-brutality/blob/main/reports/Wisconsin.md"">Click Here</a>",Madison,Police deploy smoke canister at reporter and protester,2020-06-01,June 1st,wi-madison-6,"<a href=""https://twitter.com/GeorgeBalekji/status/1267383314010312710"">Click Here</a>","Madison, Wisconsin","Madison, Dane, Wisconsin, United States of America","43.074761, -89.3837613, 0.0",43.074760999999995,-89.3837613
291,California,"<a href=""https://github.com/2020PB/police-brutality/blob/main/reports/California.md"">Click Here</a>",Walnut Creek,"Armored law enforcement vehicle threatens protesters, deploys tear gas on highway",2020-06-01,June 1st,ca-walnutcreek-1,"<a href=""https://www.instagram.com/p/CA7KMc9pX5S/"">Click Here</a>","Walnut Creek, California","Walnut Creek, Contra Costa County, California, United States of America","37.9020731, -122.0618702, 0.0",37.9020731,-122.0618702
334,Nevada,"<a href=""https://github.com/2020PB/police-brutality/blob/main/reports/Nevada.md"">Click Here</a>",Las Vegas,Police jump out of car to shove protesters,2020-06-01,June 1st,nv-lasvegas-5,"<a href=""https://www.tiktok.com/@lord.vizi/video/6833826921755741445"">Click Here</a>","Las Vegas, Nevada","Las Vegas, Clark County, Nevada, United States of America","36.1672559, -115.1485163, 0.0",36.1672559,-115.1485163
364,Illinois,"<a href=""https://github.com/2020PB/police-brutality/blob/main/reports/Illinois.md"">Click Here</a>",Chicago,Video showing CPD officer punching protester in Uptown under investigation,2020-06-01,June 1st,il-chicago-7,"<a href=""https://www.youtube.com/watch?time_continue=44&v=_urY-W8otNA"">Click Here</a>","Chicago, Illinois","Chicago, Cook County, Illinois, United States of America","41.8755616, -87.6244212, 0.0",41.875561600000005,-87.6244212
493,Minnesota,"<a href=""https://github.com/2020PB/police-brutality/blob/main/reports/Minnesota.md"">Click Here</a>",Minneapolis,Journalist shows alleged rubber bulet injury,2020-06-01,June 1st,mn-minneapolis-35,"<a href=""https://twitter.com/LionelDonovan3/status/1267477984300208128"">Click Here</a>","Minneapolis, Minnesota","Minneapolis, Hennepin County, Minnesota, United States of America","44.9772995, -93.2654692, 0.0",44.9772995,-93.2654692
505,Washington DC,"<a href=""https://github.com/2020PB/police-brutality/blob/main/reports/Washington DC.md"">Click Here</a>",DC,"Police charge peaceful crowd, beat them with shields",2020-06-01,June 1st,dc-dc-7,"<a href=""https://twitter.com/WestofHereFox/status/1267615709791731713"">Click Here</a>","DC, Washington DC","Washington, District of Columbia, 20230, United States of America","38.8949924, -77.0365581, 0.0",38.8949924,-77.0365581
502,Washington DC,"<a href=""https://github.com/2020PB/police-brutality/blob/main/reports/Washington DC.md"">Click Here</a>",DC,Officer fires tear gas canister at protester's head,2020-06-01,June 1st,dc-dc-4,"<a href=""https://mobile.twitter.com/chadloder/status/1267377374066167808"">Click Here</a>","DC, Washington DC","Washington, District of Columbia, 20230, United States of America","38.8949924, -77.0365581, 0.0",38.8949924,-77.0365581
424,Ohio,"<a href=""https://github.com/2020PB/police-brutality/blob/main/reports/Ohio.md"">Click Here</a>",Cincinnati,"Police arrest reporter and force him to ground, grab another reporter",2020-06-01,June 1st,oh-cincinnati-3,"<a href=""https://twitter.com/nswartsell/status/1267612155840528385"">Click Here</a>","Cincinnati, Ohio","Cincinnati, Hamilton County, Ohio, United States of America","39.1014537, -84.5124602, 0.0",39.1014537,-84.5124602
460,New Jersey,"<a href=""https://github.com/2020PB/police-brutality/blob/main/reports/New Jersey.md"">Click Here</a>",Asbury Park,Police arrest woman and reporter,2020-06-01,June 1st,nj-asburypark-1,"<a href=""https://www.northjersey.com/story/news/local/how-we-live/2020/06/01/app-reporter-apparently-arrested-asbury-park-george-floyd-protest/5314750002/"">Click Here</a>","Asbury Park, New Jersey","Asbury Park, New Jersey, United States of America","40.2203907, -74.0120817, 0.0",40.2203907,-74.01208170000001
285,California,"<a href=""https://github.com/2020PB/police-brutality/blob/main/reports/California.md"">Click Here</a>",San Luis Obispo,Law enforcement fire on crowd with their arms up chanting,2020-06-01,June 1st,ca-sanluisobispo-1,"<a href=""https://twitter.com/ma7dz/status/1267697838244298752"">Click Here</a>","San Luis Obispo, California","San Luis Obispo County, California, United States of America","35.3540209, -120.3757163, 0.0",35.354020899999995,-120.3757163
775,Alabama,"<a href=""https://github.com/2020PB/police-brutality/blob/main/reports/Alabama.md"">Click Here</a>",Huntsville,Protester falls and is stepped on,2020-06-01,June 1st,al-huntsville-1,"<a href=""https://twitter.com/ETfonehome97/status/1267657232411435008"">Click Here</a>","Huntsville, Alabama","Huntsville, Madison County, Alabama, United States of America","34.729847, -86.5859011, 0.0",34.729847,-86.5859011
266,California,"<a href=""https://github.com/2020PB/police-brutality/blob/main/reports/California.md"">Click Here</a>",Sacramento,Police choke man and push woman filming event to the ground,2020-06-01,June 1st,ca-sacramento-3,"<a href=""https://twitter.com/greg_doucette/status/1268334584443342850"">Click Here</a>","Sacramento, California","Sacramento, Sacramento County, California, United States of America","38.5815719, -121.4943996, 0.0",38.5815719,-121.49439960000001
506,Washington DC,"<a href=""https://github.com/2020PB/police-brutality/blob/main/reports/Washington DC.md"">Click Here</a>",DC,Police fire into crowd hitting one protester,2020-06-01,June 1st,dc-dc-8,"<a href=""https://twitter.com/i/status/1269859559859871744"">Click Here</a>","DC, Washington DC","Washington, District of Columbia, 20230, United States of America","38.8949924, -77.0365581, 0.0",38.8949924,-77.0365581
